{"seq": 0, "ts": "2026-09-01T01:16:04Z", "type": "RUN_START", "prev_hash": "0000000000000000000000000000000000000000000000000000000000000000", "payload": {"run_id": "run_20260901T011602Z", "dry_run": false, "workspace_hash": "cee82cc6d9f3aedcc436b714000e4862ddf42131b7bfe03404a4b60b87adc74a", "limits": {"max_iterations": 50, "wall_clock_s": 6300, "eps": 0.002, "N": 3, "accept_bar": 0.0014}, "model": "claude-opus-4-8", "budget_usd_ceiling": 14.0}, "hash": "9fa569bad56ead3aa414aba841f4e384d87529fb94cdf400fbd795b44a1ea4e9"}
{"seq": 1, "ts": "2026-09-01T01:18:17Z", "type": "iteration", "prev_hash": "9fa569bad56ead3aa414aba841f4e384d87529fb94cdf400fbd795b44a1ea4e9", "payload": {"iteration": 0, "hypothesis": "reproduce the official baseline", "verdict": "KEEP", "metrics": {"GAUC": 0.6681015491485596, "nDCG@5": 0.536270022392273, "primary": 0.6021857857704163, "users": 22377.0, "rows": 124909.0}, "delta_vs_parent": 0.0, "seconds": 132.84, "config": {}, "diff": "", "provenance": "harness"}, "hash": "4442afb12f0a8cd3da30dd3bf3d5d41ca38f6834a5bad5e558d7a0a1b6411df4"}
{"seq": 2, "ts": "2026-09-01T01:26:59Z", "type": "iteration", "prev_hash": "4442afb12f0a8cd3da30dd3bf3d5d41ca38f6834a5bad5e558d7a0a1b6411df4", "payload": {"iteration": 1, "hypothesis": "Rebuilding the two independently-confirmed changes together — a pure within-user listwise softmax (the 121bb7fdf312 / 50cebc5d897d implementation) plus six strictly-prior user-side aggregate fields — raises validation primary by at least +0.0035 over the reproduced baseline at 0.60219.", "mechanism": "Two separate first-order effects on within-user order. (a) The listwise softmax normalises over exactly the set the metric ranks — one user's impression list — so every gradient step trades score mass between rows of the same user, which is the only thing GAUC/nDCG can see; pointwise BCE instead spends capacity on the global positive rate, which is per-user constant and hence invisible. Restricting eligible groups to mixed-label users removes the 42.2% of users whose order is pinned and who otherwise contribute pure noise to the gradient. (b) The user-tab and user-author prior-rate buckets vary WITHIN a user's list (a user sees several tabs/authors per day), so they reorder rows first-order; the user-level prior rate is C2-constant and acts only through its FM crosses with video_id/author_id/dur_bucket.", "predicted": "", "invalid_if": "Validation primary lands below 0.6045 (i.e. delta < +0.0023) as a 3-seed mean, which would mean the two confirmed effects do not stack.", "evidence": ["Registry: prior_user_aggregates iter 4 delta +0.00281, 3/3 matched seeds positive, worst +0.00236 (largest single confirmed gain in the project)", "Registry: controlled objective ablation, listwise 0.603059 vs official 0.60147 = +0.00162, 3/3 seeds up; the winner is reproducible as model key `fm_listwise_pure`", "Registry: node objective_listwise+prior_user_aggregates recorded KEEP with a large positive delta, i.e. the two stack rather than cancel", "This run currently sits at the plain pointwise 5-field baseline, so neither confirmed change is present"], "verdict": "KEEP", "reason": "Validation primary rose +0.01126, roughly 22x the paired noise floor and 5.6x eps, and both metrics moved together (GAUC +, nDCG +). The gain is unambiguously real and far exceeds the +0.0035 the hypothesis required to stack, so it clears the invalid_if threshold decisively. This becomes the new parent.", "mechanism_update": "The two confirmed within-user effects — a list-normalised objective that spends every gradient step on same-user score mass, plus prior aggregates that vary within a user's list — combine to a gain larger than either was measured to give alone. That is consistent with them acting on the metric through different channels (objective reweights the order the loss optimises; the aggregates add first-order reorderings the FM crosses can exploit) rather than competing for the same headroom.", "deprioritise": [], "metrics": {"GAUC": 0.6828498840332031, "nDCG@5": 0.5440412163734436, "primary": 0.613445520401001, "users": 22377.0, "rows": 124909.0}, "delta_vs_parent": 0.011259734630584717, "accept_bar": 0.0014, "confirmation": {"seeds": [0, 1, 2], "paired_deltas": [0.009862, 0.010246, 0.011599], "mean_delta": 0.01056887706120809, "worst_delta": 0.009861648082733154, "all_paired_positive": true, "ensemble_delta": 0.011259734630584717, "basis": "paired_per_seed"}, "seconds": 282.14, "config": {"model": "fm_listwise_pure", "k": 16, "lr": 0.001, "bs": 8192, "patience": 4}, "seeds": [0, 1, 2], "diff": "--- a/pipeline/features.py\n+++ b/pipeline/features.py\n@@ -1,111 +1,154 @@\n-\"\"\"Feature engineering -- the only place feature changes are allowed. See AGENT_RULES.md.\r\n-\r\n-kit/data.py is frozen Starter Kit code. It cannot be edited, and this file imports\r\n-nothing from it: it only reads the splits returned by kit.data.load(splits). The per-row\r\n-schema is restated as IDX below. That restatement is not a second source of truth -- if\r\n-anyone changes the row layout in kit/data.py, this has to follow.\r\n-\r\n-Never use ANY test-split data to build features, including its labels and any statistic\r\n-derived from it (for example, do not fit bucket edges on the test split).\r\n-\r\n-Same-row input features must go through same_row(x, name). It refuses the\r\n-post-impression outcome columns in LEAKY_COLUMNS (is_click / is_like / ... /\r\n-play_time_ms / label). Those columns are legal only as multi-task targets for the same\r\n-row, or as history aggregated from OTHER rows (the user's past interactions).\r\n-\r\n-For history aggregates, use harness.history -- do not hand-roll them here:\r\n-\r\n-    from harness.history import prior_stats, bucketize\r\n-    rate, count = prior_stats(splits, signal='label', key='user_id')\r\n-\r\n-It guarantees strictly-earlier ordering, treats tied timestamps as non-predecessors, and\r\n-keeps test outcomes out of every aggregate. Building the same thing by hand in this file\r\n-means touching the label directly, which the static guard rejects, and it is the wrong\r\n-place to get the ordering right anyway.\r\n-\r\n-kit/data.py currently loads only the label out of those 11 columns. The other 10 are not\r\n-in IDX, so same_row() raises KeyError on them, which is the safe failure. Reach them\r\n-through harness.adapter, never by opening a raw CSV: log_standard_4_22_to_5_08_pure.csv\r\n-spans validation AND test and carries long_view.\r\n-\r\n-Public contract:\r\n-\r\n-    encode(splits) -> (enc, dim)\r\n-    enc[name] = (X, y, users)    # X: int32 (N, len(FIELDS)); y: float32 (N,); users: list\r\n-    dim                          # total vocab size across fields, fed to model.FM(dim, ...)\r\n-\r\n-FIELDS is not documentation: len(FIELDS) sizes vocabs and the second dimension of X. Add a\r\n-column to raw() and you must register its name in FIELDS, or the shapes will not match.\r\n-\"\"\"\r\n-import numpy as np\r\n-\r\n-# Field order of the fixed-length tuple returned by kit/data.py's load(). A restatement;\r\n-# kit/data.py itself remains the only source of truth.\r\n-IDX = {'date': 0, 'user_id': 1, 'video_id': 2, 'author_id': 3,\r\n-       'tab': 4, 'duration_ms': 5, 'label': 6}\r\n-\r\n-# Post-impression outcome/feedback columns. Never use these to predict the label of the\r\n-# SAME row. Even computed purely from train data, a same-row use leaks: they are\r\n-# concurrent outcomes of the same impression as the label, not information available\r\n-# before it. kit/data.py currently loads only the label; the rest are absent from IDX, so\r\n-# same_row() raises KeyError on them (the safe failure). The full set of 11 names is\r\n-# listed here for when those columns are eventually read in.\r\n-LEAKY_COLUMNS = frozenset({\r\n-    'label',            # long_view, the main task target itself\r\n-    'is_click', 'is_like', 'is_follow', 'is_comment', 'is_forward',\r\n-    'is_hate', 'play_time_ms', 'profile_stay_time', 'comment_stay_time',\r\n-    'is_profile_enter',\r\n-})\r\n-\r\n-# The 5 feature fields of the current kit baseline. To add a feature, add a column in\r\n-# raw() and register its name here.\r\n-FIELDS = ['user_id', 'video_id', 'author_id', 'tab', 'dur_bucket']\r\n-\r\n-def _bucket_edges(values, n=10):\r\n-    return np.quantile(np.asarray(values), np.linspace(0, 1, n + 1)[1:-1])\r\n-\r\n-def same_row(x, name):\r\n-    \"\"\"Read one column of the current row as an input feature for that row.\r\n-\r\n-    Post-impression outcome columns (see LEAKY_COLUMNS) raise here. They are legal only\r\n-    as multi-task targets for the same row, or as history features built from other\r\n-    rows -- never as an input for the row being predicted, which would feed the model\r\n-    the answer it is meant to produce.\r\n-    \"\"\"\r\n-    if name in LEAKY_COLUMNS:\r\n-        raise ValueError(f\"{name!r} is a post-impression outcome column and cannot be a \"\r\n-                         f\"same-row input feature (same-row use is limited to multi-task \"\r\n-                         f\"targets; history features must come from other rows)\")\r\n-    return x[IDX[name]]\r\n-\r\n-def encode(splits):\r\n-    \"\"\"Map categorical features to contiguous ids. Unseen values fall into the field's\r\n-    UNK slot. Bucket edges may be fitted on splits['train'] only, never valid/test.\"\"\"\r\n-    tr = splits['train']\r\n-    edges = _bucket_edges([same_row(x, 'duration_ms') for x in tr])\r\n-\r\n-    def raw(x):\r\n-        return [same_row(x, 'user_id'), same_row(x, 'video_id'), same_row(x, 'author_id'),\r\n-                same_row(x, 'tab'), str(int(np.searchsorted(edges, same_row(x, 'duration_ms'))))]\r\n-\r\n-    vocabs = [dict() for _ in FIELDS]\r\n-    for x in tr:\r\n-        for i, v in enumerate(raw(x)):\r\n-            if v not in vocabs[i]:\r\n-                vocabs[i][v] = len(vocabs[i])\r\n-    unk = [len(v) for v in vocabs]                 # one UNK slot at the end of each field\r\n-    field_dims = [len(v) + 1 for v in vocabs]\r\n-    offsets = np.cumsum([0] + field_dims[:-1]).astype(np.int32)\r\n-\r\n-    enc = {}\r\n-    for name, rws in splits.items():\r\n-        X = np.empty((len(rws), len(FIELDS)), dtype=np.int32)\r\n-        y = np.empty(len(rws), dtype=np.float32)\r\n-        users = []\r\n-        for n, x in enumerate(rws):\r\n-            for i, v in enumerate(raw(x)):\r\n-                X[n, i] = vocabs[i].get(v, unk[i]) + offsets[i]\r\n-            y[n] = x[IDX['label']]\r\n-            users.append(x[IDX['user_id']])\r\n-        enc[name] = (X, y, users)\r\n-    return enc, int(sum(field_dims))\r\n+\"\"\"Feature engineering -- the only place feature changes are allowed. See AGENT_RULES.md.\n+\n+kit/data.py is frozen Starter Kit code. It cannot be edited, and this file imports\n+nothing from it: it only reads the splits returned by kit.data.load(splits). The per-row\n+schema is restated as IDX below. That restatement is not a second source of truth -- if\n+anyone changes the row layout in kit/data.py, this has to follow.\n+\n+Never use ANY test-split data to build features, including its labels and any statistic\n+derived from it (for example, do not fit bucket edges on the test split).\n+\n+Same-row input features must go through same_row(x, name). It refuses the\n+post-impression outcome columns in LEAKY_COLUMNS (is_click / is_like / ... /\n+play_time_ms / label). Those columns are legal only as multi-task targets for the same\n+row, or as history aggregated from OTHER rows (the user's past interactions).\n+\n+For history aggregates, use harness.history -- do not hand-roll them here:\n+\n+    from harness.history import prior_stats, bucketize\n+    rate, count = prior_stats(splits, signal='label', key='user_id')\n+\n+It guarantees strictly-earlier ordering, treats tied timestamps as non-predecessors, and\n+keeps test outcomes out of every aggregate. Building the same thing by hand in this file\n+means touching the label directly, which the static guard rejects, and it is the wrong\n+place to get the ordering right anyway.\n+\n+kit/data.py currently loads only the label out of those 11 columns. The other 10 are not\n+in IDX, so same_row() raises KeyError on them, which is the safe failure. Reach them\n+through harness.adapter, never by opening a raw CSV: log_standard_4_22_to_5_08_pure.csv\n+spans validation AND test and carries long_view.\n+\n+Public contract:\n+\n+    encode(splits) -> (enc, dim)\n+    enc[name] = (X, y, users)    # X: int32 (N, len(FIELDS)); y: float32 (N,); users: list\n+    dim                          # total vocab size across fields, fed to model.FM(dim, ...)\n+\n+FIELDS is not documentation: len(FIELDS) sizes vocabs and the second dimension of X. Add a\n+column to raw() and you must register its name in FIELDS, or the shapes will not match.\n+\"\"\"\n+import numpy as np\n+\n+# Field order of the fixed-length tuple returned by kit/data.py's load(). A restatement;\n+# kit/data.py itself remains the only source of truth.\n+IDX = {'date': 0, 'user_id': 1, 'video_id': 2, 'author_id': 3,\n+       'tab': 4, 'duration_ms': 5, 'label': 6}\n+\n+# Post-impression outcome/feedback columns. Never use these to predict the label of the\n+# SAME row. Even computed purely from train data, a same-row use leaks: they are\n+# concurrent outcomes of the same impression as the label, not information available\n+# before it. kit/data.py currently loads only the label; the rest are absent from IDX, so\n+# same_row() raises KeyError on them (the safe failure). The full set of 11 names is\n+# listed here for when those columns are eventually read in.\n+LEAKY_COLUMNS = frozenset({\n+    'label',            # long_view, the main task target itself\n+    'is_click', 'is_like', 'is_follow', 'is_comment', 'is_forward',\n+    'is_hate', 'play_time_ms', 'profile_stay_time', 'comment_stay_time',\n+    'is_profile_enter',\n+})\n+\n+# The 5 official baseline fields, plus 6 strictly-prior history bucket fields.\n+# u_*  : user-level prior long_view rate + support count\n+# ut_* : (user_id, tab) prior long_view rate + support count\n+# ua_* : (user_id, author_id) prior long_view rate + support count\n+# All six are built from harness.history (strictly-earlier only, test outcomes excluded)\n+# and quantile-bucketed with edges fitted on TRAIN ONLY.\n+FIELDS = ['user_id', 'video_id', 'author_id', 'tab', 'dur_bucket',\n+          'u_rate', 'u_cnt', 'ut_rate', 'ut_cnt', 'ua_rate', 'ua_cnt']\n+\n+# History specs, in the order their (rate, count) pair extends FIELDS after the 5 base\n+# fields. Kept aligned with FIELDS[5:] above.\n+_HIST_SPECS = [\n+    ('label', 'user_id'),\n+    ('label', ('user_id', 'tab')),\n+    ('label', ('user_id', 'author_id')),\n+]\n+_HIST_NBUCKETS = 5\n+\n+def _bucket_edges(values, n=10):\n+    return np.quantile(np.asarray(values), np.linspace(0, 1, n + 1)[1:-1])\n+\n+def same_row(x, name):\n+    \"\"\"Read one column of the current row as an input feature for that row.\n+\n+    Post-impression outcome columns (see LEAKY_COLUMNS) raise here. They are legal only\n+    as multi-task targets for the same row, or as history features built from other\n+    rows -- never as an input for the row being predicted, which would feed the model\n+    the answer it is meant to produce.\n+    \"\"\"\n+    if name in LEAKY_COLUMNS:\n+        raise ValueError(f\"{name!r} is a post-impression outcome column and cannot be a \"\n+                         f\"same-row input feature (same-row use is limited to multi-task \"\n+                         f\"targets; history features must come from other rows)\")\n+    return x[IDX[name]]\n+\n+def _history_columns(splits):\n+    \"\"\"Build the 6 strictly-prior bucket columns per split via harness.history.\n+\n+    Returns {split_name: [array_u_rate, array_u_cnt, array_ut_rate, array_ut_cnt,\n+    array_ua_rate, array_ua_cnt]}, each a 1D int bucket-id array aligned to that split's\n+    rows. prior_stats sources any post-impression outcome through the adapter and refuses\n+    test rows, so no test label ever enters an aggregate; bucket edges use TRAIN ONLY.\n+    \"\"\"\n+    from harness.history import prior_stats, bucketize\n+    qs = np.linspace(0, 1, _HIST_NBUCKETS + 1)[1:-1]\n+    cols = {s: [] for s in splits}\n+    for signal, key in _HIST_SPECS:\n+        rate, count = prior_stats(splits, signal=signal, key=key)\n+        rate_edges = np.quantile(rate['train'], qs)\n+        cnt_edges = np.quantile(count['train'], qs)\n+        for s in splits:\n+            cols[s].append(np.asarray(bucketize(rate[s], rate_edges)))\n+            cols[s].append(np.asarray(bucketize(count[s], cnt_edges)))\n+    return cols\n+\n+def encode(splits):\n+    \"\"\"Map categorical features to contiguous ids. Unseen values fall into the field's\n+    UNK slot. Bucket edges may be fitted on splits['train'] only, never valid/test.\"\"\"\n+    tr = splits['train']\n+    edges = _bucket_edges([same_row(x, 'duration_ms') for x in tr])\n+\n+    hist_cols = _history_columns(splits)\n+    n_hist = len(FIELDS) - 5\n+\n+    def base_vals(x):\n+        return [same_row(x, 'user_id'), same_row(x, 'video_id'), same_row(x, 'author_id'),\n+                same_row(x, 'tab'),\n+                str(int(np.searchsorted(edges, same_row(x, 'duration_ms'))))]\n+\n+    nF = len(FIELDS)\n+    vocabs = [dict() for _ in range(nF)]\n+    Htr = hist_cols['train']\n+    for n, x in enumerate(tr):\n+        vals = base_vals(x) + [str(int(Htr[j][n])) for j in range(n_hist)]\n+        for i, v in enumerate(vals):\n+            if v not in vocabs[i]:\n+                vocabs[i][v] = len(vocabs[i])\n+    unk = [len(v) for v in vocabs]                 # one UNK slot at the end of each field\n+    field_dims = [len(v) + 1 for v in vocabs]\n+    offsets = np.cumsum([0] + field_dims[:-1]).astype(np.int32)\n+\n+    enc = {}\n+    for name, rws in splits.items():\n+        H = hist_cols[name]\n+        X = np.empty((len(rws), nF), dtype=np.int32)\n+        y = np.empty(len(rws), dtype=np.float32)\n+        users = []\n+        for n, x in enumerate(rws):\n+            vals = base_vals(x) + [str(int(H[j][n])) for j in range(n_hist)]\n+            for i, v in enumerate(vals):\n+                X[n, i] = vocabs[i].get(v, unk[i]) + offsets[i]\n+            y[n] = x[IDX['label']]\n+            users.append(x[IDX['user_id']])\n+        enc[name] = (X, y, users)\n+    return enc, int(sum(field_dims))\n--- a/pipeline/train.py\n+++ b/pipeline/train.py\n@@ -188,14 +188,18 @@\n     return out\n \n # ---------------- harness contract ----------------\n-def fit_predict(enc, dim, model='fm', k=16, lr=0.001, epochs=40, bs=8192, patience=4,\n-                seed=0, verbose=False, lw_alpha=0.3, cap=64):\n+def fit_predict(enc, dim, model='fm_listwise_pure', k=16, lr=0.001, epochs=40, bs=8192,\n+                patience=4, seed=0, verbose=False, lw_alpha=0.3, cap=64):\n     \"\"\"Train on `train` and return raw scores for every split.\n \n     THE HARNESS CALLS THIS. `run_fm`/`run_fm_listwise` above return metrics only, which\n     is enough for a human reading stdout but not enough to build a submission -- and a\n     submission built any other way (e.g. kit/submit.py --make) silently ships the\n     untouched baseline instead of whatever this pipeline learned.\n+\n+    Default model is `fm_listwise_pure`: the pure within-user softmax objective, run on\n+    top of the 5 official fields plus the 6 strictly-prior history bucket fields added\n+    in features.py -- the combined configuration under test.\n \n     Contract, preserve it when you change the model or the loss:\n         fit_predict(enc, dim, ...) -> {'train': ndarray, 'valid': ndarray, 'test': ndarray}\n", "note": "Added six strictly-prior user-side bucket fields (user, user-tab, user-author long_view rate + support count) via harness.history.prior_stats with train-only quantile edges, appending them to FIELDS so vocab sizing and X's width stay consistent. Set fit_predict's default model to the already-shipped fm_listwise_pure (pure within-user softmax, mixed-label groups only) so the harness exercises the combined listwise+history configuration under test.", "provenance": "agent", "cost_so_far_usd": 1.3399}, "hash": "80996b8dda3bdb345e156853b3b1f136533928747f385cc5da6abc852cb16b32"}
{"seq": 3, "ts": "2026-09-01T01:38:03Z", "type": "error_recovery", "prev_hash": "80996b8dda3bdb345e156853b3b1f136533928747f385cc5da6abc852cb16b32", "payload": {"iteration": 2, "failure": "agent_role", "timed_out": false, "orphan_free": true, "kill_note": "", "seconds": 0.0, "stderr": "ValueError: coder returned an invalid change twice: 'note' is not editable; only pipeline/features.py, pipeline/model.py, pipeline/train.py", "hypothesis": "", "action": "iteration skipped"}, "hash": "b267860824b75a986dd0cc108e8d2b66c83a34f4fe560034b37f10cc17c31898"}
{"seq": 4, "ts": "2026-09-01T01:38:06Z", "type": "iteration", "prev_hash": "b267860824b75a986dd0cc108e8d2b66c83a34f4fe560034b37f10cc17c31898", "payload": {"iteration": 3, "provenance": "harness", "hypothesis": "Rank-averaging the 2 best distinct candidates decorrelates their errors.", "mechanism": "An ensemble buys decorrelation, not strength; a member that is individually weaker can still help.", "verdict": "INCONCLUSIVE", "reason": "ensemble of iterations 1,0", "metrics": {"GAUC": 0.676677942276001, "nDCG@5": 0.5402940511703491, "primary": 0.608485996723175, "users": 22377.0, "rows": 124909.0}, "delta_vs_parent": -0.004959523677825928, "accept_bar": 0.0014, "seconds": 1.53, "config": {}, "diff": "", "ensemble_members": [1, 0], "cost_so_far_usd": 3.0757}, "hash": "b28ac0c154cd54ff2ffa7b6e32b4548ec1a4c0b8d7a22ca4f565d21acb93bb7b"}
