{"seq": 6, "ts": "2026-09-01T01:52:39Z", "type": "analysis", "prev_hash": "b4bf61b41f07a9d983044eb18b6b538cdb5adbd5869dc441022842956314de5e", "payload": {"iteration": 5, "analysis": "standalone_rank", "params": {"column": "time_ms"}, "question": "Ranking each validation user's impressions purely by time_ms (i.e. by their position in that user's own exposure sequence), what GAUC / nDCG@5 does it get? Equivalently: does within-user impression ORDER carry ordering signal about long_view, in either direction?", "why_needed": "Two things make this the decisive question for iteration 5. (1) Convergence pressure: iterations 3 and 4 were both non-improving, so the next experiment is effectively the run's last shot at clearing eps=0.002 — I need the candidate with the highest prior probability of a real effect, not the most interesting one. (2) The current model literally has no within-list-varying context feature: the fields are user_id, video_id, author_id, tab, dur_bucket plus six strictly-prior user aggregates, and by C2 only terms that vary inside a user's list can reorder it. time_ms/hourmin (temporal, UNTRIED in the registry) is the one untouched axis that provably varies within a user's list and is pre-impression, so it is legal as a same-row input. Which candidate I choose flips on this number: if ranking by time alone gives GAUC >= ~0.53, there is a large first-order within-user signal the model cannot currently express, and I will propose a within-user position/recency bucket field (position index within the user's exposure sequence, plus hourmin bucket) crossed with the item side — a genuinely new axis rather than another aggregate, and the aggregate axis has now missed twice on top of the kept model (item priors -0.00320, extra user priors -0.00333). If time-ordering is at chance (0.50 +/- 0.01), the axis is dead and I will instead spend the last shot on the grouped_batching_cost direction, whose registry note gives a measured -0.00239 still on the table and names concrete untested levers (larger target_bs so each step averages over more user groups, and re-tuning early stopping, since the listwise arm stops at epoch 3/4 while the same-batching pointwise arm runs to 8-11).", "result": {"column": "time_ms", "negated": false, "GAUC": 0.48403, "nDCG@5": 0.46408, "primary": 0.47405, "reference": {"random": 0.4834, "item_popularity": 0.5807, "fm_baseline": 0.6015}}}, "hash": "04d9c4de793a0f10c81e9f4f79a4367f51db6c4674569e7a2faab7840710e4c1"}
{"seq": 7, "ts": "2026-09-01T01:56:53Z", "type": "proposal_reject", "prev_hash": "04d9c4de793a0f10c81e9f4f79a4367f51db6c4674569e7a2faab7840710e4c1", "payload": {"iteration": 5, "reason": "candidate 2 is missing proposed_change"}, "hash": "a42c4509dbb4cdeb4124070d450f5b9924115155b2eefe13bb460f0f647330bf"}
{"seq": 8, "ts": "2026-09-01T02:06:36Z", "type": "iteration", "prev_hash": "a42c4509dbb4cdeb4124070d450f5b9924115155b2eefe13bb460f0f647330bf", "payload": {"iteration": 5, "hypothesis": "Adding a pointwise BCE term on ONLY the rows the listwise loss currently discards (users whose training list is all-positive or all-negative) will raise validation primary by more than 0.002, because those rows currently supply zero gradient and their item-side information is exactly what the -0.00239 grouped-batching cost measured.", "mechanism": "The discarded rows are almost all item-side observations (this video/author/tab was or was not long-viewed for this user). Learning from them sharpens the item and item-cross embeddings, and those embeddings are precisely the terms that VARY inside a mixed user's list at scoring time. So the extra signal reaches the metric through within-user reordering of mixed-label users, who carry 100% of GAUC weight and 78.9% of rows — while the listwise gradient on those users is left untouched and undiluted, unlike the REFUTED hybrid which put BCE on the same rows the softmax already covers.", "predicted": "", "invalid_if": "Validation primary drops by more than 0.0008 versus the current best 0.61345 at uni_w=0.3, or the model's best epoch collapses to 1-2 indicating the BCE term dominates.", "evidence": ["Confirmed winner 121bb7fdf312/50cebc5d897d restricts eligible groups to MIXED-LABEL users only, so every row of a uniform-label training user contributes nothing to any gradient.", "Controlled ablation: the same pointwise loss on user-grouped batches scores 0.599047 vs 0.601440 on random batches, i.e. grouping alone costs -0.00239; the registry explicitly flags 'a pointwise term restored on ungrouped rows alongside the ranking term' as untested.", "C9: 42.2% of validation users have uniform labels; the train split has a comparable uniform share, so a large block of impressions is being dropped from training entirely."], "verdict": "REVERT", "reason": "Adding a pointwise BCE term on the uniform-label rows dropped validation primary by -0.01258, ~25x the noise floor and far past the -0.0008 refutation bar the hypothesis itself set. Both GAUC (0.66607) and nDCG@5 (0.53566) fell below the pure-listwise parent, so the extra term did not sharpen item embeddings in a way that helped within-user reordering — it degraded the ordering the pure softmax had learned.", "mechanism_update": "The claim that discarded uniform-user rows are 'free' item-side signal is not borne out here. Those rows pull item/item-cross embeddings toward global long_view base rates, and that pointwise pressure competes with, rather than complements, the within-user contrast the softmax builds — even though the two gradients touch disjoint row sets, they share the same embedding parameters, so the BCE term still leaks a first-order global bias into the terms that vary inside mixed lists. The banked pure-listwise loss appears to depend on the softmax being the ONLY thing shaping item embeddings.", "deprioritise": ["mixing pointwise BCE back into the pure-listwise loss in any form", "the assumption that uniform-label training rows carry recoverable within-user signal"], "metrics": {"GAUC": 0.6660698652267456, "nDCG@5": 0.5356613993644714, "primary": 0.6008656024932861, "users": 22377.0, "rows": 124909.0}, "delta_vs_parent": -0.012579917907714844, "accept_bar": 0.0014, "confirmation": {"seeds": [0, 1, 2], "paired_deltas": [-0.010258, -0.011577, -0.012674], "mean_delta": -0.011503020922342936, "worst_delta": -0.012674212455749512, "all_paired_positive": false, "ensemble_delta": -0.012579917907714844, "basis": "paired_per_seed"}, "seconds": 198.61, "config": {"model": "fm_listwise_uni", "uni_w": 0.3}, "seeds": [0, 1, 2], "diff": "--- a/pipeline/model.py\n+++ b/pipeline/model.py\n@@ -10,6 +10,11 @@\n             # ALL positives are skipped -- they carry no ordering signal. Normalised by\n             # total positives. This is the loss behind the banked submission; see\n             # `fm_listwise_pure` in train.py. Not interchangeable with step_list below.\n+        .step_listwise_uni(X_list, y_list, group_offsets, X_uni, y_uni, uni_w=0.3) -> loss:float\n+            # Same PURE within-group softmax on the mixed-label rows (X_list/y_list),\n+            # PLUS a plain pointwise BCE term on the uniform-label rows (X_uni/y_uni)\n+            # that step_listwise would otherwise discard. No row is in both terms; the\n+            # two gradients are summed into ONE Adam update. uni_w scales the BCE term.\n         .step_list(X, y, group_ends, lw_alpha=0.3) -> loss:float\n             # X, y must be pre-sorted so that each user's rows are contiguous.\n             # group_ends: 1D int array of exclusive end offsets into X/y marking each\n@@ -102,6 +107,65 @@\n         self._apply_grad(X, g, S, E)\n         return float(loss_sum / total_pos)\n \n+    def step_listwise_uni(self, X_list, y_list, group_offsets, X_uni, y_uni, uni_w=0.3):\n+        \"\"\"Pure within-group softmax on mixed-label rows + pointwise BCE on the uniform\n+        rows the softmax discards, applied as ONE Adam update.\n+\n+        The mixed part is exactly step_listwise (softmax CE normalised by total\n+        positives). Every group in group_offsets is assumed mixed (0 < positives <\n+        size), because train.py's uni batch builder routes uniform/single-row groups to\n+        the BCE side instead. The uniform part is a plain pointwise BCE gradient scaled\n+        by uni_w / (# uniform rows). No row appears in both terms, so the listwise\n+        gradient on mixed users is left undiluted; the extra signal only sharpens\n+        item-side embeddings, which is what reorders mixed users at scoring time.\n+        \"\"\"\n+        parts_X, parts_g, parts_S, parts_E = [], [], [], []\n+        total_pos, loss_sum = 0.0, 0.0\n+\n+        # listwise term on mixed-label rows\n+        if len(y_list) > 0:\n+            z, E, S = self.logits(X_list)\n+            grad = np.zeros(len(z), dtype=np.float32)\n+            offs = group_offsets\n+            for gi in range(len(offs) - 1):\n+                s_i, e_i = int(offs[gi]), int(offs[gi + 1])\n+                if e_i - s_i < 2:\n+                    continue\n+                zg, yg = z[s_i:e_i], y_list[s_i:e_i]\n+                pos_count, size = float(yg.sum()), e_i - s_i\n+                if pos_count <= 0.0 or pos_count >= size:\n+                    continue\n+                mx = zg.max()\n+                expz = np.exp(zg - mx)\n+                denom = expz.sum()\n+                grad[s_i:e_i] = pos_count * (expz / denom) - yg\n+                loss_sum += -(float(np.sum(yg * zg)) - pos_count * (mx + np.log(denom)))\n+                total_pos += pos_count\n+            if total_pos > 0.0:\n+                parts_X.append(X_list)\n+                parts_g.append(grad / total_pos)\n+                parts_S.append(S)\n+                parts_E.append(E)\n+\n+        # pointwise BCE term on the discarded uniform-label rows\n+        if len(y_uni) > 0:\n+            zu, Eu, Su = self.logits(X_uni)\n+            Bu = len(y_uni)\n+            gu = (uni_w * (sigmoid(zu) - y_uni) / Bu).astype(np.float32)\n+            parts_X.append(X_uni)\n+            parts_g.append(gu)\n+            parts_S.append(Su)\n+            parts_E.append(Eu)\n+\n+        if not parts_X:\n+            return 0.0\n+        X_all = np.concatenate(parts_X, axis=0)\n+        g_all = np.concatenate(parts_g).astype(np.float32)\n+        S_all = np.concatenate(parts_S, axis=0)\n+        E_all = np.concatenate(parts_E, axis=0)\n+        self._apply_grad(X_all, g_all, S_all, E_all)\n+        return float(loss_sum / total_pos) if total_pos > 0.0 else 0.0\n+\n     def step_list(self, X, y, group_ends, lw_alpha=0.3):\n         \"\"\"Within-user listwise softmax (ListNet top-1), mixed with pointwise BCE.\n \n--- a/pipeline/train.py\n+++ b/pipeline/train.py\n@@ -5,6 +5,8 @@\n   --model fm_listwise  : same FM, within-user listwise softmax (ListNet top-1) + BCE mix\n   --model fm_listwise_pure : same FM, PURE within-user softmax CE, no BCE mix,\n                          uncapped groups -- the banked submission's loss\n+  --model fm_listwise_uni : fm_listwise_pure on mixed users, PLUS a pointwise BCE term on\n+                         ONLY the uniform-label rows the pure softmax discards (uni_w)\n   --model random       : random scores (lower bound; self-check that the evaluator is intact)\n numpy only. Usage: see README.md\n \"\"\"\n@@ -111,6 +113,47 @@\n     if batch_idx:\n         batches.append((Xs[batch_idx], ys[batch_idx],\n                         np.array(batch_offsets, dtype=np.int64)))\n+    return batches\n+\n+\n+def _build_grouped_batches_uni(X, y, users, target_bs=8192, rng=None):\n+    \"\"\"Like _build_grouped_batches, but split each batch's groups by label composition:\n+    mixed-label groups (0 < positives < size) go to the listwise side (with their own\n+    contiguous offsets), and uniform-label or single-row groups go to the pointwise\n+    side. No row is ever on both sides.\n+\n+    Returns a list of (X_list, y_list, list_offsets, X_uni, y_uni) tuples. Either the\n+    listwise or the pointwise part of a batch may be empty (0-row arrays).\n+    \"\"\"\n+    users_arr = np.asarray(users)\n+    order = np.argsort(users_arr, kind='stable')\n+    Xs, ys, us = X[order], y[order], users_arr[order]\n+    change = np.where(us[1:] != us[:-1])[0] + 1\n+    bounds = np.concatenate(([0], change, [len(us)]))\n+    groups = [(int(bounds[i]), int(bounds[i + 1])) for i in range(len(bounds) - 1)]\n+    if rng is not None:\n+        rng.shuffle(groups)\n+\n+    batches = []\n+    list_idx, list_offsets, uni_idx, cur = [], [0], [], 0\n+    for (st, en) in groups:\n+        size = en - st\n+        pos = float(ys[st:en].sum())\n+        if size >= 2 and 0.0 < pos < size:\n+            list_idx.extend(range(st, en))\n+            list_offsets.append(list_offsets[-1] + size)\n+        else:\n+            uni_idx.extend(range(st, en))\n+        cur += size\n+        if cur >= target_bs:\n+            batches.append((Xs[list_idx], ys[list_idx],\n+                            np.array(list_offsets, dtype=np.int64),\n+                            Xs[uni_idx], ys[uni_idx]))\n+            list_idx, list_offsets, uni_idx, cur = [], [0], [], 0\n+    if list_idx or uni_idx:\n+        batches.append((Xs[list_idx], ys[list_idx],\n+                        np.array(list_offsets, dtype=np.int64),\n+                        Xs[uni_idx], ys[uni_idx]))\n     return batches\n \n \n@@ -187,9 +230,41 @@\n         out['test'] = evaluate(ute, yte, m.predict(Xte))\n     return out\n \n+def run_fm_listwise_uni(splits, k=16, lr=0.001, epochs=40, bs=8192, patience=4, seed=0,\n+                         verbose=True, uni_w=0.3):\n+    \"\"\"Pure within-user softmax on mixed-label users (as fm_listwise_pure) PLUS a\n+    pointwise BCE term on ONLY the uniform-label rows the pure softmax discards, scaled\n+    by uni_w. No row is on both sides, so the mixed-user listwise gradient is left\n+    undiluted; the extra signal sharpens item-side embeddings only. Selection/early\n+    stopping use valid primary only (test never touched here).\"\"\"\n+    enc, dim = encode(splits)\n+    Xtr, ytr, utr = enc['train']; Xva, yva, uva = enc['valid']\n+    m = FM(dim, k=k, lr=lr, seed=seed)\n+    rng = np.random.default_rng(seed)\n+    best, best_state, bad = -1, None, 0\n+    for ep in range(1, epochs + 1):\n+        t0 = time.time()\n+        for (Xl, yl, offs, Xu, yu) in _build_grouped_batches_uni(Xtr, ytr, utr,\n+                                                                 target_bs=bs, rng=rng):\n+            m.step_listwise_uni(Xl, yl, offs, Xu, yu, uni_w=uni_w)\n+        va = evaluate(uva, yva, m.predict(Xva))\n+        if verbose:\n+            print(f\"  epoch {ep:2d} | valid GAUC {va['GAUC']:.4f} nDCG@5 {va['nDCG@5']:.4f} \"\n+                  f\"primary {va['primary']:.4f} | {time.time()-t0:.1f}s\")\n+        if va['primary'] > best + 1e-5:\n+            best, bad = va['primary'], 0\n+            best_state = (m.V.copy(), m.W.copy(), np.float32(m.b))\n+        else:\n+            bad += 1\n+            if bad >= patience:\n+                if verbose: print(f\"  early stop at epoch {ep}\")\n+                break\n+    m.V, m.W, m.b = best_state\n+    return {'valid': evaluate(uva, yva, m.predict(Xva))}\n+\n # ---------------- harness contract ----------------\n def fit_predict(enc, dim, model='fm_listwise_pure', k=16, lr=0.001, epochs=40, bs=8192,\n-                patience=4, seed=0, verbose=False, lw_alpha=0.3, cap=64):\n+                patience=4, seed=0, verbose=False, lw_alpha=0.3, cap=64, uni_w=0.3):\n     \"\"\"Train on `train` and return raw scores for every split.\n \n     THE HARNESS CALLS THIS. `run_fm`/`run_fm_listwise` above return metrics only, which\n@@ -250,6 +325,28 @@\n         m.V, m.W, m.b = best_state\n         return {sp: m.predict(enc[sp][0]) for sp in enc}\n \n+    if model == 'fm_listwise_uni':\n+        # Pure softmax on mixed users + pointwise BCE on the discarded uniform rows.\n+        m = FM(dim, k=k, lr=lr, seed=seed)\n+        rng = np.random.default_rng(seed)\n+        best, best_state, bad = -1, None, 0\n+        for ep in range(1, epochs + 1):\n+            for (Xl, yl, offs, Xu, yu) in _build_grouped_batches_uni(Xtr, ytr, utr,\n+                                                                    target_bs=bs, rng=rng):\n+                m.step_listwise_uni(Xl, yl, offs, Xu, yu, uni_w=uni_w)\n+            p = evaluate(uva, yva, m.predict(Xva))['primary']\n+            if verbose:\n+                print(f\"  epoch {ep:2d} valid primary {p:.5f}\", flush=True)\n+            if p > best + 1e-5:\n+                best, bad = p, 0\n+                best_state = (m.V.copy(), m.W.copy(), np.float32(m.b))\n+            else:\n+                bad += 1\n+                if bad >= patience:\n+                    break\n+        m.V, m.W, m.b = best_state\n+        return {sp: m.predict(enc[sp][0]) for sp in enc}\n+\n     if model == 'fm_listwise':\n         user_to_idx = _group_rows_by_user(utr)\n         m = FM(dim, k=k, lr=lr, seed=seed)\n@@ -299,13 +396,16 @@\n     ap.add_argument('--data_dir', default='./KuaiRand-Pure/data',\n                     help='the extracted KuaiRand-Pure data directory')\n     ap.add_argument('--model', default='fm',\n-                    choices=['pop', 'fm', 'fm_listwise', 'fm_listwise_pure', 'random'])\n+                    choices=['pop', 'fm', 'fm_listwise', 'fm_listwise_pure',\n+                             'fm_listwise_uni', 'random'])\n     ap.add_argument('--k', type=int, default=16)\n     ap.add_argument('--lr', type=float, default=0.001)\n     ap.add_argument('--epochs', type=int, default=40)\n     ap.add_argument('--seed', type=int, default=0)\n     ap.add_argument('--lw_alpha', type=float, default=0.3,\n                     help='weight of the pointwise BCE term mixed into fm_listwise loss')\n+    ap.add_argument('--uni_w', type=float, default=0.3,\n+                    help='weight of the pointwise BCE term on discarded uniform-label rows (fm_listwise_uni)')\n     ap.add_argument('--cap', type=int, default=64,\n                     help='max rows per user group in a listwise batch (subsampled if exceeded)')\n     ap.add_argument('--final', action='store_true',\n@@ -320,7 +420,10 @@\n                                    report_test=a.final),\n            'fm_listwise': lambda s: run_fm_listwise(s, k=a.k, lr=a.lr, epochs=a.epochs,\n                                                      seed=a.seed, report_test=a.final,\n-                                                     lw_alpha=a.lw_alpha, cap=a.cap)}[a.model](splits)\n+                                                     lw_alpha=a.lw_alpha, cap=a.cap),\n+           'fm_listwise_uni': lambda s: run_fm_listwise_uni(s, k=a.k, lr=a.lr,\n+                                                            epochs=a.epochs, seed=a.seed,\n+                                                            uni_w=a.uni_w)}[a.model](splits)\n     print(f\"\\n=== {a.model} (seed={a.seed}) ===\")\n     for sp in (('valid', 'test') if a.final else ('valid',)):\n         r = res[sp]\n", "note": "", "provenance": "agent", "cost_so_far_usd": 6.1615}, "hash": "4cb4f81c6695da9e620b5c2802c243d73c911a754f1fd699c3465868a5e16883"}
