{"seq": 5, "ts": "2026-09-01T01:50:25Z", "type": "iteration", "prev_hash": "b28ac0c154cd54ff2ffa7b6e32b4548ec1a4c0b8d7a22ca4f565d21acb93bb7b", "payload": {"iteration": 4, "hypothesis": "Replacing the binary within-user softmax target with a graded target distribution that gives clicked-but-not-long-viewed impressions partial probability mass raises validation primary by more than +0.0015 over the current best (0.61345).", "mechanism": "Inside one user's list the current loss treats all long_view=0 rows as interchangeable, so the model gets no supervision about the ordering among the 4 of a user's 5 negatives -- yet GAUC and nDCG@5 are decided precisely by where the positive sits among those negatives. Giving clicked negatives partial target mass imposes an ordering (long_view > clicked > ignored) that is 0.75-correlated with the scored label, and it makes lists that are uniform in long_view but mixed in click non-degenerate, so users currently contributing zero gradient start training their own user embedding and the item embeddings they saw.", "predicted": "", "invalid_if": "Validation primary over 3 matched seeds fails to exceed the current best by +0.0015, or GAUC falls while nDCG@5 rises (which would show the click grading is reordering negatives without helping the scored order).", "evidence": ["The confirmed winner trains a pure within-user softmax on MIXED-LABEL long_view groups only, so every all-negative and all-positive long_view user is skipped entirely; validation shows 30.3% all-negative and 11.9% all-positive users, and the train split has the same structural property at lower rate.", "data_profile 7: validation Pearson r(is_click, long_view) = 0.7515 with is_click density 0.44 -- a dense, strongly aligned ordering signal.", "C3/C4: post-impression columns are legal as TARGETS; harness.adapter.auxiliary_targets(('is_click',)) returns them aligned and test-free.", "Registry: the two REFUTED hybrid attempts mixed a pointwise BCE term into the loss at weight 0.5/0.3; this changes only the target distribution of the same pure listwise loss and adds no BCE term and no extra head."], "verdict": "REVERT", "reason": "Predicted +0.0015; measured -0.00145, a small but above-noise regression (~3 sigma over the 0.0005 floor, still under eps). The clicked-negative grading did not sharpen within-user order -- both GAUC (0.68078) and nDCG@5 (0.54322) sit at or below the binary-listwise parent, so the invalid_if 'GAUC down while nDCG up' pattern did not occur; instead the graded mass diffused supervision away from the scored positive rather than usefully ordering the negatives.", "mechanism_update": "Imposing long_view>clicked>ignored via target mass does not translate into better long_view ranking here. Click is 0.75-correlated with long_view marginally, but within a single user's short list that correlation is largely absorbed by the positive's own mass; handing partial mass to clicked negatives pulls softmax probability toward rows the metric scores as 0, which slightly degrades the ordering the metric actually rewards. The newly-admitted click-mixed-but-long_view-uniform groups did not add net signal.", "deprioritise": [], "metrics": {"GAUC": 0.6807765364646912, "nDCG@5": 0.5432243347167969, "primary": 0.6120004653930664, "users": 22377.0, "rows": 124909.0}, "delta_vs_parent": -0.0014450550079345703, "accept_bar": 0.0014, "confirmation": {"seeds": [0, 1, 2], "paired_deltas": [-0.001605, -0.001365, -0.002262], "mean_delta": -0.0017438332239786785, "worst_delta": -0.002262115478515625, "all_paired_positive": false, "ensemble_delta": -0.0014450550079345703, "basis": "paired_per_seed"}, "seconds": 253.97, "config": {"model": "fm_listwise_graded", "aux_w": 0.3}, "seeds": [0, 1, 2], "diff": "--- a/pipeline/features.py\n+++ b/pipeline/features.py\n@@ -36,6 +36,11 @@\n \n FIELDS is not documentation: len(FIELDS) sizes vocabs and the second dimension of X. Add a\n column to raw() and you must register its name in FIELDS, or the shapes will not match.\n+\n+Multi-task auxiliary target (this iteration): is_click is pulled through\n+harness.adapter.auxiliary_targets and stashed in a module global keyed by split, retrieved\n+via get_aux_click(). It is a TARGET only -- it never enters FIELDS or X, and it is never a\n+same-row input. The adapter refuses test rows, so no test outcome ever reaches here.\n \"\"\"\n import numpy as np\n \n@@ -75,6 +80,47 @@\n ]\n _HIST_NBUCKETS = 5\n \n+# Module-level cache of the is_click auxiliary TARGET, keyed by split name, populated by\n+# encode() and read by train.py via get_aux_click(). Target only; never an input feature.\n+_AUX_CLICK = {}\n+\n+def get_aux_click():\n+    \"\"\"Return {split: float32 click array} as populated by the last encode() call.\n+\n+    is_click is a permitted multi-task TARGET (LEAKY_COLUMNS forbids it only as a\n+    same-row input). Sourced through harness.adapter, which drops test rows, so this dict\n+    never carries a test outcome.\n+    \"\"\"\n+    return _AUX_CLICK\n+\n+def _load_aux_click(splits):\n+    \"\"\"Populate _AUX_CLICK with the is_click column per split via harness.adapter.\n+\n+    Positional alignment with kit.data.load() is guaranteed by the adapter, so each array\n+    lines up 1:1 with that split's encoded rows. On any failure (adapter missing, etc.)\n+    the cache is left empty and callers fall back to zeros -- the default fm_listwise_pure\n+    path never reads this, so a failure here cannot break the banked model.\n+    \"\"\"\n+    global _AUX_CLICK\n+    _AUX_CLICK = {}\n+    try:\n+        from harness.adapter import auxiliary_targets\n+        raw = auxiliary_targets(('is_click',))\n+    except Exception:\n+        return\n+    if not isinstance(raw, dict):\n+        return\n+    for s in splits:\n+        if s not in raw:\n+            continue\n+        v = raw[s]\n+        col = v.get('is_click') if isinstance(v, dict) else v\n+        if col is None:\n+            continue\n+        arr = np.asarray(col, dtype=np.float32)\n+        if len(arr) == len(splits[s]):\n+            _AUX_CLICK[s] = arr\n+\n def _bucket_edges(values, n=10):\n     return np.quantile(np.asarray(values), np.linspace(0, 1, n + 1)[1:-1])\n \n@@ -120,6 +166,9 @@\n \n     hist_cols = _history_columns(splits)\n     n_hist = len(FIELDS) - 5\n+\n+    # Populate the is_click auxiliary target cache (target only; not used below).\n+    _load_aux_click(splits)\n \n     def base_vals(x):\n         return [same_row(x, 'user_id'), same_row(x, 'video_id'), same_row(x, 'author_id'),\n--- a/pipeline/model.py\n+++ b/pipeline/model.py\n@@ -10,6 +10,16 @@\n             # ALL positives are skipped -- they carry no ordering signal. Normalised by\n             # total positives. This is the loss behind the banked submission; see\n             # `fm_listwise_pure` in train.py. Not interchangeable with step_list below.\n+        .step_listwise_graded(X, t, group_offsets) -> loss:float\n+            # Same packed-group softmax cross-entropy as step_listwise, but the per-row\n+            # target is a graded MASS t_i (e.g. label_i + aux_w * click_i) rather than a\n+            # 0/1 label. Within each group the target is normalised to a distribution\n+            # p_i = t_i / sum(t); the loss is CE(softmax(scores), p). Groups whose target\n+            # vector is CONSTANT (all rows equal -- including all-zero) carry no ordering\n+            # signal and are skipped, which is what makes lists uniform in long_view but\n+            # mixed in click non-degenerate. Normalised by total target mass in the batch,\n+            # mirroring step_listwise's normalise-by-positives. With t == binary label\n+            # this reduces exactly to step_listwise.\n         .step_list(X, y, group_ends, lw_alpha=0.3) -> loss:float\n             # X, y must be pre-sorted so that each user's rows are contiguous.\n             # group_ends: 1D int array of exclusive end offsets into X/y marking each\n@@ -101,6 +111,48 @@\n         g = (grad / total_pos).astype(np.float32)\n         self._apply_grad(X, g, S, E)\n         return float(loss_sum / total_pos)\n+\n+    def step_listwise_graded(self, X, t, group_offsets):\n+        \"\"\"Graded-target within-group softmax cross-entropy.\n+\n+        Identical scaffolding to step_listwise -- packed contiguous groups, no BCE term,\n+        no cap -- but the supervision is a per-row target MASS t_i instead of a 0/1\n+        label. Within a group the mass is normalised to a distribution p_i = t_i / mass,\n+        and the loss is CE(softmax(z), p). A group is eligible iff its target vector is\n+        NOT constant (max > min) and carries positive mass; constant groups (all rows\n+        equal, e.g. all-zero) give no ordering signal and are skipped. This admits users\n+        whose long_view is uniform but whose click grade is not. The gradient is\n+        mass * softmax(z) - t (which sums to zero per group), normalised by the total\n+        target mass over the batch. With t equal to the binary label this reduces\n+        exactly to step_listwise.\n+        \"\"\"\n+        z, E, S = self.logits(X)\n+        grad = np.zeros(len(z), dtype=np.float32)\n+        total_mass, loss_sum = 0.0, 0.0\n+        offs = group_offsets\n+        for gi in range(len(offs) - 1):\n+            s_i, e_i = int(offs[gi]), int(offs[gi + 1])\n+            if e_i - s_i < 2:\n+                continue\n+            zg, tg = z[s_i:e_i], t[s_i:e_i]\n+            mass = float(tg.sum())\n+            if mass <= 0.0:\n+                continue\n+            if float(tg.max()) - float(tg.min()) <= 0.0:   # constant target -> no signal\n+                continue\n+            mx = zg.max()\n+            expz = np.exp(zg - mx)\n+            denom = expz.sum()\n+            grad[s_i:e_i] = mass * (expz / denom) - tg\n+            logq = (zg - mx) - np.log(denom)\n+            loss_sum += -float(np.sum(tg * logq))\n+            total_mass += mass\n+\n+        if total_mass <= 0.0:\n+            return 0.0\n+        g = (grad / total_mass).astype(np.float32)\n+        self._apply_grad(X, g, S, E)\n+        return float(loss_sum / total_mass)\n \n     def step_list(self, X, y, group_ends, lw_alpha=0.3):\n         \"\"\"Within-user listwise softmax (ListNet top-1), mixed with pointwise BCE.\n--- a/pipeline/train.py\n+++ b/pipeline/train.py\n@@ -5,6 +5,9 @@\n   --model fm_listwise  : same FM, within-user listwise softmax (ListNet top-1) + BCE mix\n   --model fm_listwise_pure : same FM, PURE within-user softmax CE, no BCE mix,\n                          uncapped groups -- the banked submission's loss\n+  --model fm_listwise_graded : same scaffolding as fm_listwise_pure, but the per-list\n+                         target is graded (label + aux_w * is_click) normalised within\n+                         the list; eligibility is 'target vector not constant'\n   --model random       : random scores (lower bound; self-check that the evaluator is intact)\n numpy only. Usage: see README.md\n \"\"\"\n@@ -17,7 +20,7 @@\n \n from data import load\n from evaluate import evaluate\n-from features import encode, FIELDS, IDX\n+from features import encode, FIELDS, IDX, get_aux_click\n from model import FM\n \n # ---------------- item popularity (official baseline) ----------------\n@@ -87,6 +90,10 @@\n     Transcribed from run 20260830T235541Z iteration 1 along with FM.step_listwise.\n     Note this is NOT the batching `fm_listwise` uses: `_make_listwise_batches` below\n     subsamples any group larger than `cap`, and this one does not.\n+\n+    The carried array (`y` here) is passed through untouched, so the same builder serves\n+    both the binary-label pure objective and the graded-mass objective (pass the graded\n+    target in place of y).\n \n     Returns a list of (Xb, yb, group_offsets) tuples.\n     \"\"\"\n@@ -187,9 +194,53 @@\n         out['test'] = evaluate(ute, yte, m.predict(Xte))\n     return out\n \n+def run_fm_listwise_graded(splits, k=16, lr=0.001, epochs=40, bs=8192, patience=4,\n+                           seed=0, verbose=True, report_test=False, aux_w=0.5):\n+    \"\"\"fm_listwise_pure scaffolding with a graded per-list target.\n+\n+    Target mass per row is t_i = label_i + aux_w * click_i (is_click sourced as a\n+    multi-task TARGET via harness.adapter, never as an input). Within each user list the\n+    mass is normalised to a distribution and trained with softmax cross-entropy\n+    (FM.step_listwise_graded), which imposes the ordering long_view > clicked > ignored.\n+    Groups whose target vector is constant are skipped inside the step. Early\n+    stopping/model selection stay on valid primary.\"\"\"\n+    enc, dim = encode(splits)\n+    Xtr, ytr, utr = enc['train']; Xva, yva, uva = enc['valid']\n+    aux = get_aux_click()\n+    click_tr = aux.get('train')\n+    if click_tr is None or len(click_tr) != len(ytr):\n+        click_tr = np.zeros(len(ytr), dtype=np.float32)\n+    ttr = (ytr + np.float32(aux_w) * click_tr).astype(np.float32)\n+    m = FM(dim, k=k, lr=lr, seed=seed)\n+    rng = np.random.default_rng(seed)\n+    best, best_state, bad = -1, None, 0\n+    for ep in range(1, epochs + 1):\n+        t0 = time.time()\n+        losses = []\n+        for (Xb, tb, offs) in _build_grouped_batches(Xtr, ttr, utr, target_bs=bs, rng=rng):\n+            losses.append(m.step_listwise_graded(Xb, tb, offs))\n+        va = evaluate(uva, yva, m.predict(Xva))\n+        if verbose:\n+            print(f\"  epoch {ep:2d} | loss {np.mean(losses):.4f} | valid GAUC {va['GAUC']:.4f} \"\n+                  f\"nDCG@5 {va['nDCG@5']:.4f} primary {va['primary']:.4f} | {time.time()-t0:.1f}s\")\n+        if va['primary'] > best + 1e-5:\n+            best, bad = va['primary'], 0\n+            best_state = (m.V.copy(), m.W.copy(), np.float32(m.b))\n+        else:\n+            bad += 1\n+            if bad >= patience:\n+                if verbose: print(f\"  early stop at epoch {ep}\")\n+                break\n+    m.V, m.W, m.b = best_state\n+    out = {'valid': evaluate(uva, yva, m.predict(Xva))}\n+    if report_test:\n+        Xte, yte, ute = enc['test']\n+        out['test'] = evaluate(ute, yte, m.predict(Xte))\n+    return out\n+\n # ---------------- harness contract ----------------\n def fit_predict(enc, dim, model='fm_listwise_pure', k=16, lr=0.001, epochs=40, bs=8192,\n-                patience=4, seed=0, verbose=False, lw_alpha=0.3, cap=64):\n+                patience=4, seed=0, verbose=False, lw_alpha=0.3, cap=64, aux_w=0.0):\n     \"\"\"Train on `train` and return raw scores for every split.\n \n     THE HARNESS CALLS THIS. `run_fm`/`run_fm_listwise` above return metrics only, which\n@@ -199,7 +250,9 @@\n \n     Default model is `fm_listwise_pure`: the pure within-user softmax objective, run on\n     top of the 5 official fields plus the 6 strictly-prior history bucket fields added\n-    in features.py -- the combined configuration under test.\n+    in features.py -- the combined configuration under test. `aux_w` defaults to 0.0 so\n+    every default path is bit-identical; it only takes effect under the\n+    `fm_listwise_graded` model.\n \n     Contract, preserve it when you change the model or the loss:\n         fit_predict(enc, dim, ...) -> {'train': ndarray, 'valid': ndarray, 'test': ndarray}\n@@ -250,6 +303,36 @@\n         m.V, m.W, m.b = best_state\n         return {sp: m.predict(enc[sp][0]) for sp in enc}\n \n+    if model == 'fm_listwise_graded':\n+        # Graded-target variant: t_i = label_i + aux_w * click_i, normalised within the\n+        # user list, softmax cross-entropy. is_click is a multi-task TARGET pulled\n+        # through harness.adapter (never a same-row input, never in FIELDS). With\n+        # aux_w == 0.0 this is mathematically identical to fm_listwise_pure.\n+        aux = get_aux_click()\n+        click_tr = aux.get('train')\n+        if click_tr is None or len(click_tr) != len(ytr):\n+            click_tr = np.zeros(len(ytr), dtype=np.float32)\n+        ttr = (ytr + np.float32(aux_w) * click_tr).astype(np.float32)\n+        m = FM(dim, k=k, lr=lr, seed=seed)\n+        rng = np.random.default_rng(seed)\n+        best, best_state, bad = -1, None, 0\n+        for ep in range(1, epochs + 1):\n+            for (Xb, tb, offs) in _build_grouped_batches(Xtr, ttr, utr, target_bs=bs,\n+                                                         rng=rng):\n+                m.step_listwise_graded(Xb, tb, offs)\n+            p = evaluate(uva, yva, m.predict(Xva))['primary']\n+            if verbose:\n+                print(f\"  epoch {ep:2d} valid primary {p:.5f}\", flush=True)\n+            if p > best + 1e-5:\n+                best, bad = p, 0\n+                best_state = (m.V.copy(), m.W.copy(), np.float32(m.b))\n+            else:\n+                bad += 1\n+                if bad >= patience:\n+                    break\n+        m.V, m.W, m.b = best_state\n+        return {sp: m.predict(enc[sp][0]) for sp in enc}\n+\n     if model == 'fm_listwise':\n         user_to_idx = _group_rows_by_user(utr)\n         m = FM(dim, k=k, lr=lr, seed=seed)\n@@ -299,7 +382,8 @@\n     ap.add_argument('--data_dir', default='./KuaiRand-Pure/data',\n                     help='the extracted KuaiRand-Pure data directory')\n     ap.add_argument('--model', default='fm',\n-                    choices=['pop', 'fm', 'fm_listwise', 'fm_listwise_pure', 'random'])\n+                    choices=['pop', 'fm', 'fm_listwise', 'fm_listwise_pure',\n+                             'fm_listwise_graded', 'random'])\n     ap.add_argument('--k', type=int, default=16)\n     ap.add_argument('--lr', type=float, default=0.001)\n     ap.add_argument('--epochs', type=int, default=40)\n@@ -308,6 +392,8 @@\n                     help='weight of the pointwise BCE term mixed into fm_listwise loss')\n     ap.add_argument('--cap', type=int, default=64,\n                     help='max rows per user group in a listwise batch (subsampled if exceeded)')\n+    ap.add_argument('--aux_w', type=float, default=0.5,\n+                    help='weight of is_click grade in fm_listwise_graded per-list target')\n     ap.add_argument('--final', action='store_true',\n                     help='also score and print test (final report only; never while iterating)')\n     a = ap.parse_args()\n@@ -320,7 +406,10 @@\n                                    report_test=a.final),\n            'fm_listwise': lambda s: run_fm_listwise(s, k=a.k, lr=a.lr, epochs=a.epochs,\n                                                      seed=a.seed, report_test=a.final,\n-                                                     lw_alpha=a.lw_alpha, cap=a.cap)}[a.model](splits)\n+                                                     lw_alpha=a.lw_alpha, cap=a.cap),\n+           'fm_listwise_graded': lambda s: run_fm_listwise_graded(s, k=a.k, lr=a.lr,\n+                                                     epochs=a.epochs, seed=a.seed,\n+                                                     report_test=a.final, aux_w=a.aux_w)}[a.model](splits)\n     print(f\"\\n=== {a.model} (seed={a.seed}) ===\")\n     for sp in (('valid', 'test') if a.final else ('valid',)):\n         r = res[sp]\n", "note": "Added a graded within-user softmax objective: features.py stashes is_click as a multi-task TARGET (via harness.adapter, test rows excluded) retrievable through get_aux_click(); model.py gains step_listwise_graded (per-list target t=label+aux_w*click normalised to a distribution, CE against softmax, constant-target groups skipped, normalised by total mass), and train.py adds the fm_listwise_graded model plus aux_w kwarg (default 0.0, so every default path stays bit-identical). With aux_w=0 the graded loss reduces exactly to the banked fm_listwise_pure, and only the new model reads the click target.", "provenance": "agent", "cost_so_far_usd": 4.2518}, "hash": "b4bf61b41f07a9d983044eb18b6b538cdb5adbd5869dc441022842956314de5e"}
