{"seq": 6, "ts": "2026-08-31T01:39:03Z", "type": "iteration", "prev_hash": "3d17e5a99a502a08301fd3db5d084ad97ed9bc605684b560e1099dbcb7c98317", "payload": {"iteration": 4, "hypothesis": "Adding strictly-prior behavioural aggregates as bucketized categorical FM fields — user-level engagement rate (acting only through its crosses), user×tab affinity, and user×author affinity — raises validation primary by more than the 0.002 noise floor over the five-field baseline.", "mechanism": "The FM currently expresses user taste only as V_user · V_item, a rank-16 estimate fitted from a median of 31 impressions per user; user×tab and user×author affinity rates are direct, low-variance, count-smoothed estimates of the same quantity and vary within a user's impression list (tab and author differ across a user's rows), so their first-order terms alone reorder that user's list. The user-level rate bucket is constant within a user and therefore contributes nothing first-order, but its embedding crosses with video_id/author_id/tab let the model rerank items differently for high- vs low-engagement users — the one legal channel C2 leaves open for user-side signal.", "predicted": "+0.003 valid primary (0.60147 -> ~0.6045); anything at or below +0.0008 is a seed", "invalid_if": "Validation primary delta <= +0.0008, or a diagnostic shows any of the new fields takes a single value for >95% of validation rows within a user (i.e. it is invariant and cannot move the metric).", "evidence": ["C2: purely additive user-side terms are provably zero for within-user ranking, but user information reaching the score through crosses with item/context features is untested and explicitly left open.", "C13: 98.114% of validation users have >=1 prior train interaction; 3.381% of validation rows have a prior same-author interaction; every train timestamp precedes every validation timestamp, so all of train is legal history.", "C12: 98.373% of validation user-video pairs are novel while 98-99.9% of individual entities are warm — the model must generalise at the relationship level, which is exactly what a smoothed affinity statistic supplies and a k=16 dot product estimates noisily.", "Journal iters 1-3: the objective-family route (listwise -0.00233, BPR hybrid -0.00139, hybrid inconclusive) has consumed three iterations with no gain; the representation route is untouched.", "harness.history.prior_stats guarantees strictly-earlier-only aggregation, ties excluded, test outcomes never entering — §0b."], "verdict": "KEEP", "reason": "Validation primary rose +0.00462, roughly 9x the noise floor and above the 0.002 eps, driven mainly by GAUC (0.6674->0.6738) with a smaller nDCG@5 lift (0.5357->0.5384). This is consistent with the claimed mechanism: within-user-varying prior affinity fields (user x tab, user x author) reorder impressions inside a list, and the user-rate bucket's crosses let high- vs low-engagement users be reranked differently.", "mechanism_update": "The rank-16 V_user . V_item term does not fully capture user taste at a median of 31 impressions; direct count-smoothed prior affinity aggregates at finer keys (user x tab, user x author) carry within-list-varying signal the FM was not otherwise expressing. Strictly-prior behavioural history is a live source of headroom that first-order user-side features (ruled out by C2) could not reach. The GAUC-dominant gain suggests the benefit is chiefly in pairwise ordering of mixed-label users, less in top-5 gain.", "deprioritise": ["pure static-feature stuffing", "FM width scaling"], "metrics": {"GAUC": 0.6737902760505676, "nDCG@5": 0.5383939146995544, "primary": 0.606092095375061, "users": 22377.0, "rows": 124909.0}, "delta_vs_parent": 0.0028082728385925293, "accept_bar": 0.0014, "confirmation": {"seeds": [0, 1, 2], "per_seed_primary": [0.603832483291626, 0.604447603225708, 0.6045532822608948], "mean_primary": 0.6042777895927429, "mean_delta": 0.0028082728385925293, "worst_delta": 0.002362966537475586, "single_seed_delta": 0.002362966537475586, "ensemble_primary": 0.606092095375061, "seconds": 311.65}, "seconds": 311.65, "config": {}, "seeds": [0, 1, 2], "diff": "--- a/pipeline/features.py\n+++ b/pipeline/features.py\n@@ -39,6 +39,8 @@\n \"\"\"\n import numpy as np\n \n+from harness.history import prior_stats, bucketize\n+\n # Field order of the fixed-length tuple returned by kit/data.py's load(). A restatement;\n # kit/data.py itself remains the only source of truth.\n IDX = {'date': 0, 'user_id': 1, 'video_id': 2, 'author_id': 3,\n@@ -57,9 +59,19 @@\n     'is_profile_enter',\n })\n \n-# The 5 feature fields of the current kit baseline. To add a feature, add a column in\n-# raw() and register its name here.\n-FIELDS = ['user_id', 'video_id', 'author_id', 'tab', 'dur_bucket']\n+# The 5 baseline fields plus 4 strictly-prior behavioural aggregate fields:\n+#   u_rate_b   : user-level prior long_view rate bucket (constant within a user; acts\n+#                only through its FM cross terms -- the one legal channel C2 leaves open)\n+#   ut_rate_b  : user x tab prior long_view rate bucket (varies within a user's list)\n+#   ua_rate_b  : user x author prior long_view rate bucket (varies within a user's list)\n+#   ua_count_b : user x author prior-interaction count bucket (confidence of ua_rate_b)\n+# Bin 0 of every rate field is a dedicated 'no prior history' slot (count == 0).\n+FIELDS = ['user_id', 'video_id', 'author_id', 'tab', 'dur_bucket',\n+          'u_rate_b', 'ut_rate_b', 'ua_rate_b', 'ua_count_b']\n+\n+# Smoothing constant toward the train global mean, matching the official item-popularity\n+# baseline's prior weight of 20.\n+PRIOR_WEIGHT = 20.0\n \n def _bucket_edges(values, n=10):\n     return np.quantile(np.asarray(values), np.linspace(0, 1, n + 1)[1:-1])\n@@ -78,19 +90,77 @@\n                          f\"targets; history features must come from other rows)\")\n     return x[IDX[name]]\n \n+def _rate_buckets(rate, count, nbins):\n+    \"\"\"Bucketize a strictly-prior rate array into nbins quantile bins, with bin 0\n+    reserved for rows that have no prior history (count == 0). Edges are fit on the\n+    TRAIN split's rows-with-history only, then applied to every split.\"\"\"\n+    tr_rate = np.asarray(rate['train'])\n+    tr_mask = np.asarray(count['train']) > 0\n+    src = tr_rate[tr_mask] if tr_mask.any() else tr_rate\n+    qs = np.linspace(0, 1, nbins + 1)[1:-1]\n+    edges = np.quantile(src, qs)\n+    out = {}\n+    for s in rate:\n+        b = bucketize(np.asarray(rate[s]), edges)          # 0 .. nbins-1\n+        b = np.where(np.asarray(count[s]) > 0, b + 1, 0)   # shift; 0 == no history\n+        out[s] = b.astype(np.int64)\n+    return out\n+\n+def _count_buckets(count):\n+    \"\"\"Map a prior-interaction count array into {0,1,2,3-5,6+} -> {0,1,2,3,4}.\"\"\"\n+    out = {}\n+    for s, c in count.items():\n+        c = np.asarray(c)\n+        b = np.zeros(len(c), dtype=np.int64)\n+        b[c == 1] = 1\n+        b[c == 2] = 2\n+        b[(c >= 3) & (c <= 5)] = 3\n+        b[c >= 6] = 4\n+        out[s] = b\n+    return out\n+\n def encode(splits):\n     \"\"\"Map categorical features to contiguous ids. Unseen values fall into the field's\n     UNK slot. Bucket edges may be fitted on splits['train'] only, never valid/test.\"\"\"\n     tr = splits['train']\n     edges = _bucket_edges([same_row(x, 'duration_ms') for x in tr])\n \n-    def raw(x):\n+    # Strictly-prior behavioural aggregates (harness.history guarantees earlier-only\n+    # ordering, tie-exclusion, and no test outcomes reach any aggregate).\n+    u_rate, u_count = prior_stats(splits, signal='label', key='user_id',\n+                                  prior_weight=PRIOR_WEIGHT)\n+    ut_rate, ut_count = prior_stats(splits, signal='label', key=('user_id', 'tab'),\n+                                    prior_weight=PRIOR_WEIGHT)\n+    ua_rate, ua_count = prior_stats(splits, signal='label', key=('user_id', 'author_id'),\n+                                    prior_weight=PRIOR_WEIGHT)\n+\n+    u_b = _rate_buckets(u_rate, u_count, nbins=8)\n+    ut_b = _rate_buckets(ut_rate, ut_count, nbins=5)\n+    ua_b = _rate_buckets(ua_rate, ua_count, nbins=5)\n+    uac_b = _count_buckets(ua_count)\n+\n+    def base_raw(x):\n         return [same_row(x, 'user_id'), same_row(x, 'video_id'), same_row(x, 'author_id'),\n-                same_row(x, 'tab'), str(int(np.searchsorted(edges, same_row(x, 'duration_ms'))))]\n+                same_row(x, 'tab'),\n+                str(int(np.searchsorted(edges, same_row(x, 'duration_ms'))))]\n+\n+    # Full per-split feature rows (base 5 + 4 aggregate buckets), positionally aligned.\n+    feats = {}\n+    for name, rws in splits.items():\n+        rows = []\n+        ub, tb, ab, cb = u_b[name], ut_b[name], ua_b[name], uac_b[name]\n+        for n, x in enumerate(rws):\n+            r = base_raw(x)\n+            r.append(int(ub[n]))\n+            r.append(int(tb[n]))\n+            r.append(int(ab[n]))\n+            r.append(int(cb[n]))\n+            rows.append(r)\n+        feats[name] = rows\n \n     vocabs = [dict() for _ in FIELDS]\n-    for x in tr:\n-        for i, v in enumerate(raw(x)):\n+    for r in feats['train']:\n+        for i, v in enumerate(r):\n             if v not in vocabs[i]:\n                 vocabs[i][v] = len(vocabs[i])\n     unk = [len(v) for v in vocabs]                 # one UNK slot at the end of each field\n@@ -99,11 +169,13 @@\n \n     enc = {}\n     for name, rws in splits.items():\n-        X = np.empty((len(rws), len(FIELDS)), dtype=np.int32)\n-        y = np.empty(len(rws), dtype=np.float32)\n+        rows = feats[name]\n+        X = np.empty((len(rows), len(FIELDS)), dtype=np.int32)\n+        y = np.empty(len(rows), dtype=np.float32)\n         users = []\n         for n, x in enumerate(rws):\n-            for i, v in enumerate(raw(x)):\n+            r = rows[n]\n+            for i, v in enumerate(r):\n                 X[n, i] = vocabs[i].get(v, unk[i]) + offsets[i]\n             y[n] = x[IDX['label']]\n             users.append(x[IDX['user_id']])\n", "note": "Added four strictly-prior behavioural aggregate fields to features.py via harness.history.prior_stats: user long_view-rate bucket (8 bins, acts through crosses), user×tab and user×author rate buckets (5 bins each, vary within a user's list), and a user×author count confidence bucket; bin 0 of each rate field is a reserved no-history slot, edges are fit on train-with-history only, and FIELDS grew accordingly. model.py and train.py are untouched so the default pointwise FM isolates the representation change.", "provenance": "agent", "cost_so_far_usd": 2.8573}, "hash": "11fbbb0472330c179e9ff7d0dd337c64d8d53bc92a037c9882cbab42c6a94164"}
{"seq": 7, "ts": "2026-08-31T01:44:45Z", "type": "iteration", "prev_hash": "11fbbb0472330c179e9ff7d0dd337c64d8d53bc92a037c9882cbab42c6a94164", "payload": {"iteration": 5, "hypothesis": "Adding strictly-prior ITEM-side and USER×ITEM-side aggregates (video prior long_view rate + support bucket, author prior long_view rate + support bucket, user×author prior rate + support bucket) as bucketized categorical FM fields raises validation primary by more than 0.002 over the current 0.60609, because unlike the user-level aggregates kept in iter 4 these vary *within* a user's impression list and therefore act on the ranking directly rather than only through cross terms.", "mechanism": "The FM currently sees `video_id` and `author_id` only as free embeddings fitted from the training loss. For tail videos/authors (long tail: 87% of authors have a single video, and validation lists are dominated by items with modest train support) those embeddings are noisy and under-trained. A smoothed prior long_view rate, bucketized into ~8 quantile bins from TRAIN edges, gives a low-variance, directly-ordinal item-quality signal shared across all rare items, plus a count bucket that lets the FM learn how much to trust it. Because this quantity differs between the items in one user's list, it moves within-user ordering — which is exactly what GAUC and nDCG@5 measure. The user×author prior rate adds a genuine personalization term on the 3.4% of rows where the user has seen that author before, again varying within the list.", "predicted": "+0.003 validation primary (0.606 -> ~0.609); a null result would be <=+0.001", "invalid_if": "Validation primary changes by less than +0.001 relative to the iter-4 checkpoint at matched seed, or degrades — that would mean the identity embeddings already saturate item-side prior information.", "evidence": ["iter 4 KEEP, +0.00281: strictly-prior behavioural aggregates as bucketized categorical fields are the only direction that has cleared noise so far, so the mechanism (history via harness.history, bucketized, FM-crossed) is validated in this pipeline.", "C2 (HARD FACT): terms constant within a user contribute exactly zero; user-level aggregates can only act through crosses, whereas item/author/user-author priors differ across the rows of one user's list.", "Item popularity alone scores validation primary 0.5807 vs random 0.4834 — item-side prior engagement is a large standalone signal in this data.", "C12/C13: 99.88% of validation videos and 99.91% of authors are warm in train, so item- and author-level prior aggregates have near-complete support (unlike exact user-video repeats at 1.62%); user-author prior covers 3.38% of validation rows, which is small but nonzero and falls through to an UNK/no-history bucket elsewhere.", "C5/C6: static feature stuffing and width scaling are dead, so headroom is not in capacity — it is in information the current 5 identity/context fields do not carry, i.e. calibrated prior outcome rates with an explicit support/reliability signal."], "verdict": "REVERT", "reason": "Delta is -0.00320, over 6 sigma below the noise floor and beyond eps in the wrong direction. The added item-side priors did not sharpen within-user ordering; they degraded it. The claim was that video/author embeddings are noisy for tail items and a smoothed prior rate would help directly — the measured sign refutes that: the identity embeddings already carry the item-quality signal, and the extra bucket fields inject redundant, coarser, collinear information that dilutes the fitted interactions rather than stabilising them.", "mechanism_update": "Item-side prior long_view rate is already saturated by the free video_id/author_id embeddings under the training loss — consistent with C12 (99.9% of validation videos/authors are warm) and C5 (static item-side expansion was neutral-to-negative). A bucketized prior is a lossy projection of what the embedding already learns, so it competes for FM cross-term capacity and adds variance. This differs from iter-4's user-level aggregate, which added a channel the model had NO other access to (user quality only reaches ranking via cross terms); item quality was never missing. 'Varies within the list' is necessary but not sufficient — the item embedding also varies within the list and already encodes this.", "deprioritise": ["bucketized item-side / author-side prior-rate aggregates as FM fields", "user x author prior-rate/count fields (bundled here, no evidence of lift, and the 3.4% row coverage bounds their possible effect below eps anyway)", "further hand-crafted smoothed target-encoding fields layered on top of warm identity embeddings"], "metrics": {"GAUC": 0.6697717905044556, "nDCG@5": 0.5360085964202881, "primary": 0.6028901934623718, "users": 22377.0, "rows": 124909.0}, "delta_vs_parent": -0.003201901912689209, "accept_bar": 0.0014, "confirmation": null, "seconds": 188.21, "config": {"model": "fm", "k": 16, "lr": 0.001}, "seeds": [0], "diff": "--- a/pipeline/features.py\n+++ b/pipeline/features.py\n@@ -59,15 +59,23 @@\n     'is_profile_enter',\n })\n \n-# The 5 baseline fields plus 4 strictly-prior behavioural aggregate fields:\n+# The 5 baseline fields, the 4 iter-4 user-side/user-context/user-author aggregates, plus\n+# 4 NEW strictly-prior ITEM-side aggregates (this iteration):\n #   u_rate_b   : user-level prior long_view rate bucket (constant within a user; acts\n #                only through its FM cross terms -- the one legal channel C2 leaves open)\n #   ut_rate_b  : user x tab prior long_view rate bucket (varies within a user's list)\n #   ua_rate_b  : user x author prior long_view rate bucket (varies within a user's list)\n #   ua_count_b : user x author prior-interaction count bucket (confidence of ua_rate_b)\n-# Bin 0 of every rate field is a dedicated 'no prior history' slot (count == 0).\n+#   v_rate_b   : video-level prior long_view rate bucket (varies within a user's list)\n+#   v_count_b  : video prior-interaction count bucket (confidence of v_rate_b)\n+#   a_rate_b   : author-level prior long_view rate bucket (varies within a user's list)\n+#   a_count_b  : author prior-interaction count bucket (confidence of a_rate_b)\n+# Bin 0 of every rate field is a dedicated 'no prior history' slot (count == 0). Because\n+# v_rate_b / a_rate_b / ua_rate_b differ between items in one user's list, they move\n+# within-user ordering directly -- which is what GAUC and nDCG@5 measure.\n FIELDS = ['user_id', 'video_id', 'author_id', 'tab', 'dur_bucket',\n-          'u_rate_b', 'ut_rate_b', 'ua_rate_b', 'ua_count_b']\n+          'u_rate_b', 'ut_rate_b', 'ua_rate_b', 'ua_count_b',\n+          'v_rate_b', 'v_count_b', 'a_rate_b', 'a_count_b']\n \n # Smoothing constant toward the train global mean, matching the official item-popularity\n # baseline's prior weight of 20.\n@@ -133,28 +141,42 @@\n                                     prior_weight=PRIOR_WEIGHT)\n     ua_rate, ua_count = prior_stats(splits, signal='label', key=('user_id', 'author_id'),\n                                     prior_weight=PRIOR_WEIGHT)\n+    # NEW item-side aggregates: video-level and author-level prior long_view rates.\n+    v_rate, v_count = prior_stats(splits, signal='label', key='video_id',\n+                                  prior_weight=PRIOR_WEIGHT)\n+    a_rate, a_count = prior_stats(splits, signal='label', key='author_id',\n+                                  prior_weight=PRIOR_WEIGHT)\n \n     u_b = _rate_buckets(u_rate, u_count, nbins=8)\n     ut_b = _rate_buckets(ut_rate, ut_count, nbins=5)\n     ua_b = _rate_buckets(ua_rate, ua_count, nbins=5)\n     uac_b = _count_buckets(ua_count)\n+    v_b = _rate_buckets(v_rate, v_count, nbins=8)\n+    vc_b = _count_buckets(v_count)\n+    a_b = _rate_buckets(a_rate, a_count, nbins=8)\n+    ac_b = _count_buckets(a_count)\n \n     def base_raw(x):\n         return [same_row(x, 'user_id'), same_row(x, 'video_id'), same_row(x, 'author_id'),\n                 same_row(x, 'tab'),\n                 str(int(np.searchsorted(edges, same_row(x, 'duration_ms'))))]\n \n-    # Full per-split feature rows (base 5 + 4 aggregate buckets), positionally aligned.\n+    # Full per-split feature rows (base 5 + 4 user-side + 4 item-side buckets), aligned.\n     feats = {}\n     for name, rws in splits.items():\n         rows = []\n         ub, tb, ab, cb = u_b[name], ut_b[name], ua_b[name], uac_b[name]\n+        vb, vcb, aab, acb = v_b[name], vc_b[name], a_b[name], ac_b[name]\n         for n, x in enumerate(rws):\n             r = base_raw(x)\n             r.append(int(ub[n]))\n             r.append(int(tb[n]))\n             r.append(int(ab[n]))\n             r.append(int(cb[n]))\n+            r.append(int(vb[n]))\n+            r.append(int(vcb[n]))\n+            r.append(int(aab[n]))\n+            r.append(int(acb[n]))\n             rows.append(r)\n         feats[name] = rows\n \n", "note": "Added four strictly-prior item-side FM fields (video rate+support and author rate+support buckets via harness.history.prior_stats on 'label'), keeping every iter-4 user-side field; these vary within a user's impression list so they act on within-user ranking directly rather than only through cross terms.", "provenance": "agent", "cost_so_far_usd": 3.2887}, "hash": "f2b73e41b04a28624c08b052d0c6da6e825df1c5cdcb1aca631d28f65b65fa0a"}
