{"seq": 0, "ts": "2026-08-31T01:13:56Z", "type": "RUN_START", "prev_hash": "0000000000000000000000000000000000000000000000000000000000000000", "payload": {"run_id": "run_20260831T011354Z", "dry_run": false, "workspace_hash": "5492542a5addb2b0527acf1071ed614915763af772744dad052bfa33ef846272", "limits": {"max_iterations": 50, "wall_clock_s": 21600, "eps": 0.002, "N": 3, "accept_bar": 0.0014}, "model": "claude-opus-4-8", "budget_usd_ceiling": 14.0}, "hash": "f806e3e62ae752bd68558c158975e5642fdd8563e38248f2d5d03964020e7d09"}
{"seq": 1, "ts": "2026-08-31T01:14:47Z", "type": "iteration", "prev_hash": "f806e3e62ae752bd68558c158975e5642fdd8563e38248f2d5d03964020e7d09", "payload": {"iteration": 0, "hypothesis": "reproduce the official baseline", "verdict": "KEEP", "metrics": {"GAUC": 0.6671333909034729, "nDCG@5": 0.5358057022094727, "primary": 0.6014695167541504, "users": 22377.0, "rows": 124909.0}, "delta_vs_parent": 0.0, "seconds": 50.54, "config": {}, "diff": "", "provenance": "harness"}, "hash": "2f2f6a2d394196a1cef2c2c28e14cc8b8052e05cc1152f62f2c6ff87a743dcbf"}
{"seq": 2, "ts": "2026-08-31T01:17:44Z", "type": "iteration", "prev_hash": "2f2f6a2d394196a1cef2c2c28e14cc8b8052e05cc1152f62f2c6ff87a743dcbf", "payload": {"iteration": 1, "hypothesis": "Replacing pointwise logloss with a within-user listwise softmax (cross-entropy over each user's impression group, positives as the target distribution) raises validation primary by more than 0.002 over the 0.60147 pointwise FM.", "mechanism": "Softmax over a user's scores makes the gradient depend only on score differences inside the group. Constant-within-user terms get zero gradient (exactly the terms C2 proves cannot affect the metric), so all capacity goes into within-user contrast — which is literally what GAUC (pairwise order) and nDCG@5 (top-of-list order) measure. Under binary labels the listwise softmax is a consistent surrogate for nDCG-style top-heavy ordering, and it upweights getting the top position right, which is where nDCG@5 gain concentrates for short lists (median 4).", "predicted": "+0.004 to +0.010 valid primary (0.605-0.611); a null result is anything under +0.002", "invalid_if": "Validation primary stays within +/-0.002 of 0.60147 after early stopping, or GAUC rises while nDCG@5 falls by an equal amount leaving primary flat.", "evidence": ["The organizer's own judged ranking of headroom puts loss/objective mismatch first: training is pointwise logloss while the metric is a within-user ranking metric (RULES §5, README).", "Both metrics depend only on within-user ordering (C23), so any per-user monotone shift the pointwise loss spends capacity on is wasted effort.", "Mixed-label users are 57.778% of validation users and hold 78.907% of rows (C9), so a group loss has real signal on most of the data.", "Journal: two prior iterations of run 20260830T230438Z added listwise/BPR code but never activated it via config, so the direction is untested, not refuted."], "verdict": "REVERT", "reason": "The listwise softmax landed at 0.59914, -0.00233 below the pointwise parent — past both the noise floor (sigma ~0.0005) and eps (0.002). Both components dropped (GAUC 0.6638 vs 0.6674, nDCG@5 0.5345 vs 0.5357), so this is a genuine small regression, not a wash or a GAUC/nDCG trade. The claimed mechanism (gradient on within-user contrast only) is real, but it did not translate into a better ranking here.", "mechanism_update": "Concentrating all gradient on within-user contrast is not automatically better than pointwise BCE on this data. Two plausible reasons: (1) median list length 4 with 42% uniform-label users means the softmax target is degenerate or near-degenerate for a large fraction of groups — all-positive groups give a flat target and all-negative groups contribute no ranking signal, so the loss is dominated by very short, low-information lists; (2) a plain full-group softmax with binary targets is a fairly weak, top-diffuse surrogate and can under-train the mid-list ordering that GAUC rewards. Pointwise BCE remains a surprisingly strong parent — the objective-mismatch headroom is not captured by this particular listwise form.", "deprioritise": ["plain full-group listwise softmax with binary targets as the sole objective"], "metrics": {"GAUC": 0.663790225982666, "nDCG@5": 0.5344973802566528, "primary": 0.5991438031196594, "users": 22377.0, "rows": 124909.0}, "delta_vs_parent": -0.002325713634490967, "accept_bar": 0.0014, "confirmation": null, "seconds": 33.76, "config": {"model": "fm_listwise", "lr": 0.001, "k": 16, "bs": 8192, "epochs": 40, "patience": 4}, "seeds": [0], "diff": "--- a/pipeline/train.py\n+++ b/pipeline/train.py\n@@ -151,7 +151,7 @@\n     return out\n \n # ---------------- harness contract ----------------\n-def fit_predict(enc, dim, model='fm', k=16, lr=0.001, epochs=40, bs=8192, patience=4,\n+def fit_predict(enc, dim, model='fm_listwise', k=16, lr=0.001, epochs=40, bs=8192, patience=4,\n                 seed=0, verbose=False, lw_alpha=0.3, cap=64):\n     \"\"\"Train on `train` and return raw scores for every split.\n \n@@ -159,6 +159,10 @@\n     is enough for a human reading stdout but not enough to build a submission -- and a\n     submission built any other way (e.g. kit/submit.py --make) silently ships the\n     untouched baseline instead of whatever this pipeline learned.\n+\n+    Default is now `fm_listwise`: the within-user listwise softmax is the hypothesis\n+    under test, so the harness must route through it to produce a scored submission.\n+    The `fm` (pointwise BCE) code path below is unchanged and remains selectable.\n \n     Contract, preserve it when you change the model or the loss:\n         fit_predict(enc, dim, ...) -> {'train': ndarray, 'valid': ndarray, 'test': ndarray}\n@@ -205,7 +209,7 @@\n         m.V, m.W, m.b = best_state\n         return {sp: m.predict(enc[sp][0]) for sp in enc}\n \n-    # default: model == 'fm', pointwise BCE\n+    # model == 'fm', pointwise BCE (unchanged; kept byte-identical for a clean A/B)\n     m = FM(dim, k=k, lr=lr, seed=seed)\n     rng = np.random.default_rng(seed)\n     best, best_state, bad = -1, None, 0\n", "note": "The listwise FM was fully coded but fit_predict (the harness entry point that builds the submission) still defaulted to model='fm', so the harness would have scored the pointwise baseline and produced a null A/B; I changed only fit_predict's default to 'fm_listwise' so the harness routes through the within-user softmax path, leaving the pointwise 'fm' code path byte-identical and still selectable.", "provenance": "agent", "cost_so_far_usd": 0.7298}, "hash": "747420eb2fb27251a95808e58116d999075bd8048b3c70102174a7aa09f77328"}
{"seq": 3, "ts": "2026-08-31T01:23:01Z", "type": "error_recovery", "prev_hash": "747420eb2fb27251a95808e58116d999075bd8048b3c70102174a7aa09f77328", "payload": {"iteration": 2, "failure": "contract", "timed_out": false, "orphan_free": true, "kill_note": "", "seconds": 0.75, "stderr": "Traceback (most recent call last):\n  File \"<frozen runpy>\", line 198, in _run_module_as_main\n  File \"<frozen runpy>\", line 88, in _run_code\n  File \"C:\\Users\\nicho\\OneDrive\\Documents\\Hackathon\\kuairand-starter-kit\\harness\\run_node.py\", line 79, in <module>\n    main()\n    ~~~~^^\n  File \"C:\\Users\\nicho\\OneDrive\\Documents\\Hackathon\\kuairand-starter-kit\\harness\\run_node.py\", line 41, in main\n    p = fit_predict(enc, dim, seed=s, **cfg)\nTypeError: fit_predict() got an unexpected keyword argument 'listwise_weight'\n", "hypothesis": "A hybrid objective — pointwise BCE plus a weighted within-user listwise softmax term (applied only to mixed-label groups) — beats pure pointwise BCE by ≥0.002 validation primary, whereas the pure listwise replacement of iteration 1 lost 0.00233 because it discarded the training signal from the 42% of users whose groups are label-uniform.", "action": "node pruned"}, "hash": "f8680b2123778823c8d1794e23c56bf0ad8cc33eb1d575b58d019af5aaa0dfa9"}
{"seq": 4, "ts": "2026-08-31T01:23:11Z", "type": "iteration", "prev_hash": "f8680b2123778823c8d1794e23c56bf0ad8cc33eb1d575b58d019af5aaa0dfa9", "payload": {"iteration": 2, "hypothesis": "A hybrid objective — pointwise BCE plus a weighted within-user listwise softmax term (applied only to mixed-label groups) — beats pure pointwise BCE by ≥0.002 validation primary, whereas the pure listwise replacement of iteration 1 lost 0.00233 because it discarded the training signal from the 42% of users whose groups are label-uniform.", "verdict": "INCONCLUSIVE", "reason": "No metric was produced. The run died on a contract mismatch: the harness called fit_predict with keyword 'listwise_weight', which fit_predict does not accept. This says nothing about whether the BCE-anchored hybrid beats pointwise BCE — the loss code never executed on a full run.", "metrics": null, "delta_vs_parent": null, "failure": "contract", "seconds": 0.75, "config": {"model": "fm_hybrid", "listwise_weight": 0.3, "lr": 0.001, "k": 16}, "diff": "--- a/pipeline/model.py\n+++ b/pipeline/model.py\n@@ -4,10 +4,12 @@\n     FM(dim, k=16, lr=0.001, l2=1e-6, seed=0)\n         .step(X, y) -> loss:float      # one mini-batch gradient update (pointwise BCE)\n         .step_list(X, y, group_ends, lw_alpha=0.3) -> loss:float\n-            # X, y must be pre-sorted so that each user's rows are contiguous.\n-            # group_ends: 1D int array of exclusive end offsets into X/y marking each\n-            # user group (e.g. [3, 3, 5] means groups [0:3], [3:3] (empty, skipped),\n-            # [3:5]). Within-group softmax (ListNet top-1) mixed with lw_alpha * BCE.\n+            # within-user softmax (ListNet top-1) dominant + lw_alpha * BCE mix.\n+        .step_hybrid(X, y, group_ends, lw=0.3) -> loss:float\n+            # BCE ANCHOR (full weight, every row) + lw * within-user softmax term\n+            # (only over mixed-label groups, i.e. groups with 0<positives<size).\n+            # This is the reverse mix of step_list: pointwise BCE is the base loss and\n+            # the listwise term is an additive rank-shaping pressure of weight lw.\n         .predict(X, bs=200_000) -> np.ndarray[float]   # scores; higher = more relevant\n         .V, .W, .b                     # used by train.py to save/restore the best checkpoint\n \"\"\"\n@@ -59,9 +61,7 @@\n \n         X, y must already be sorted so each user's rows are contiguous; group_ends\n         gives the exclusive end index of each contiguous group. Groups with zero\n-        positives contribute no listwise gradient (target distribution p_i = y_i /\n-        sum(y) is undefined) but still contribute their BCE term, so all-negative\n-        users still push item-side signal.\n+        positives contribute no listwise gradient but still contribute their BCE term.\n \n         Loss = mean_over_active_groups(-sum_i p_i log q_i) + lw_alpha * mean_BCE_all_rows\n         \"\"\"\n@@ -98,5 +98,52 @@\n         avg_list_loss = total_listwise_loss / max(n_active, 1)\n         return avg_list_loss + lw_alpha * bce_loss\n \n+    def step_hybrid(self, X, y, group_ends, lw=0.3):\n+        \"\"\"BCE-anchored hybrid: pointwise BCE over EVERY row (full weight) plus an\n+        additive within-user softmax (ListNet top-1) term of weight `lw` applied only\n+        to mixed-label groups (0 < positives < group_size).\n+\n+        This is the reverse mix of step_list. BCE keeps every row -- including the rows\n+        of the ~42% of users whose groups are label-uniform -- pushing gradient into the\n+        shared embeddings (the absolute-rate anchoring), while the listwise term shapes\n+        only the within-user score differences that GAUC / nDCG@5 actually read on the\n+        ~58% of users that can move.\n+\n+        Loss = mean_BCE_all_rows + lw * mean_over_mixed_groups(-sum_i p_i log q_i)\n+        \"\"\"\n+        B = len(y)\n+        z, E, S = self.logits(X)\n+        p_sig = sigmoid(z)\n+        g_bce = ((p_sig - y) / B).astype(np.float32)      # full-weight BCE anchor\n+\n+        g_list = np.zeros(B, dtype=np.float32)\n+        start = 0\n+        n_active = 0\n+        total_listwise_loss = 0.0\n+        for end in group_ends:\n+            if end > start:\n+                y_g = y[start:end]\n+                s_g = y_g.sum()\n+                size = end - start\n+                if 0 < s_g < size:                        # mixed-label group only\n+                    z_g = z[start:end]\n+                    zg = z_g - z_g.max()\n+                    ez = np.exp(zg)\n+                    q = ez / ez.sum()\n+                    p_g = y_g / s_g\n+                    g_list[start:end] = (q - p_g)\n+                    n_active += 1\n+                    total_listwise_loss += float(-np.sum(p_g * np.log(q + 1e-9)))\n+            start = end\n+        if n_active > 0:\n+            g_list *= (lw / n_active)\n+\n+        g = (g_bce + g_list).astype(np.float32)\n+        self._apply_grad(X, g, S, E)\n+\n+        bce_loss = float(-np.mean(y * np.log(p_sig + 1e-9) + (1 - y) * np.log(1 - p_sig + 1e-9)))\n+        avg_list_loss = total_listwise_loss / max(n_active, 1)\n+        return bce_loss + lw * avg_list_loss\n+\n     def predict(self, X, bs=200_000):\n         return np.concatenate([self.logits(X[i:i + bs])[0] for i in range(0, len(X), bs)])\n--- a/pipeline/train.py\n+++ b/pipeline/train.py\n@@ -3,6 +3,8 @@\n   --model pop          : item popularity (official baseline; pure statistics, no training)\n   --model fm           : Factorization Machine, pointwise BCE (the starting model)\n   --model fm_listwise  : same FM, within-user listwise softmax (ListNet top-1) + BCE mix\n+  --model fm_hybrid    : same FM, BCE-anchored hybrid (full BCE + lw * within-user softmax\n+                         over mixed-label groups only)\n   --model random       : random scores (lower bound; self-check that the evaluator is intact)\n numpy only. Usage: see README.md\n \"\"\"\n@@ -115,10 +117,7 @@\n def run_fm_listwise(splits, k=16, lr=0.001, epochs=40, bs=8192, patience=4, seed=0,\n                      verbose=True, report_test=False, lw_alpha=0.3, cap=64):\n     \"\"\"Same FM capacity as run_fm, trained with a within-user listwise softmax\n-    (ListNet top-1) mixed with lw_alpha * pointwise BCE. Batches are built by grouping\n-    train rows by user_id (each user's group capped at `cap` rows), so the softmax\n-    gradient only ever compares scores within the same user -- exactly the quantity\n-    GAUC and nDCG@5 depend on. Early stopping/model selection stay on valid primary.\"\"\"\n+    (ListNet top-1) mixed with lw_alpha * pointwise BCE.\"\"\"\n     enc, dim = encode(splits)\n     Xtr, ytr, utr = enc['train']; Xva, yva, uva = enc['valid']\n     user_to_idx = _group_rows_by_user(utr)\n@@ -150,17 +149,50 @@\n         out['test'] = evaluate(ute, yte, m.predict(Xte))\n     return out\n \n+def run_fm_hybrid(splits, k=16, lr=0.001, epochs=40, bs=8192, patience=4, seed=0,\n+                   verbose=True, report_test=False, lw=0.3, cap=64):\n+    \"\"\"Same FM capacity as run_fm, trained with a BCE-anchored hybrid loss: full-weight\n+    pointwise BCE over every row plus an additive within-user softmax term of weight `lw`\n+    applied only to mixed-label groups. User-grouped batching keeps each user's rows\n+    contiguous so the listwise term only ever compares scores within a user. Early\n+    stopping / model selection stay on valid primary.\"\"\"\n+    enc, dim = encode(splits)\n+    Xtr, ytr, utr = enc['train']; Xva, yva, uva = enc['valid']\n+    user_to_idx = _group_rows_by_user(utr)\n+    m = FM(dim, k=k, lr=lr, seed=seed)\n+    rng = np.random.default_rng(seed)\n+    best, best_state, bad = -1, None, 0\n+    for ep in range(1, epochs + 1):\n+        t0 = time.time()\n+        batches = _make_listwise_batches(user_to_idx, bs, cap, rng)\n+        losses = []\n+        for idxs, ends in batches:\n+            losses.append(m.step_hybrid(Xtr[idxs], ytr[idxs], ends, lw=lw))\n+        va = evaluate(uva, yva, m.predict(Xva))\n+        if verbose:\n+            print(f\"  epoch {ep:2d} | loss {np.mean(losses):.4f} | valid GAUC {va['GAUC']:.4f} \"\n+                  f\"nDCG@5 {va['nDCG@5']:.4f} primary {va['primary']:.4f} | {time.time()-t0:.1f}s\")\n+        if va['primary'] > best + 1e-5:\n+            best, bad = va['primary'], 0\n+            best_state = (m.V.copy(), m.W.copy(), np.float32(m.b))\n+        else:\n+            bad += 1\n+            if bad >= patience:\n+                if verbose: print(f\"  early stop at epoch {ep}\")\n+                break\n+    m.V, m.W, m.b = best_state\n+    out = {'valid': evaluate(uva, yva, m.predict(Xva))}\n+    if report_test:\n+        Xte, yte, ute = enc['test']\n+        out['test'] = evaluate(ute, yte, m.predict(Xte))\n+    return out\n+\n # ---------------- harness contract ----------------\n def fit_predict(enc, dim, model='fm', k=16, lr=0.001, epochs=40, bs=8192, patience=4,\n-                seed=0, verbose=False, lw_alpha=0.3, cap=64):\n+                seed=0, verbose=False, lw_alpha=0.3, lw=0.3, cap=64):\n     \"\"\"Train on `train` and return raw scores for every split.\n \n-    THE HARNESS CALLS THIS. `run_fm`/`run_fm_listwise` above return metrics only, which\n-    is enough for a human reading stdout but not enough to build a submission -- and a\n-    submission built any other way (e.g. kit/submit.py --make) silently ships the\n-    untouched baseline instead of whatever this pipeline learned.\n-\n-    Contract, preserve it when you change the model or the loss:\n+    THE HARNESS CALLS THIS. Contract, preserve it:\n         fit_predict(enc, dim, ...) -> {'train': ndarray, 'valid': ndarray, 'test': ndarray}\n     One float per row, higher = more relevant, aligned to enc[split] row order. Selection\n     and early stopping use `valid` only; `test` scores are produced but never read here.\n@@ -183,7 +215,7 @@\n         rng = np.random.default_rng(seed)\n         return {sp: rng.random(len(enc[sp][1])) for sp in enc}\n \n-    if model == 'fm_listwise':\n+    if model in ('fm_listwise', 'fm_hybrid'):\n         user_to_idx = _group_rows_by_user(utr)\n         m = FM(dim, k=k, lr=lr, seed=seed)\n         rng = np.random.default_rng(seed)\n@@ -191,7 +223,10 @@\n         for ep in range(1, epochs + 1):\n             batches = _make_listwise_batches(user_to_idx, bs, cap, rng)\n             for idxs, ends in batches:\n-                m.step_list(Xtr[idxs], ytr[idxs], ends, lw_alpha=lw_alpha)\n+                if model == 'fm_hybrid':\n+                    m.step_hybrid(Xtr[idxs], ytr[idxs], ends, lw=lw)\n+                else:\n+                    m.step_list(Xtr[idxs], ytr[idxs], ends, lw_alpha=lw_alpha)\n             p = evaluate(uva, yva, m.predict(Xva))['primary']\n             if verbose:\n                 print(f\"  epoch {ep:2d} valid primary {p:.5f}\", flush=True)\n@@ -231,13 +266,15 @@\n     ap = argparse.ArgumentParser()\n     ap.add_argument('--data_dir', default='./KuaiRand-Pure/data',\n                     help='the extracted KuaiRand-Pure data directory')\n-    ap.add_argument('--model', default='fm', choices=['pop', 'fm', 'fm_listwise', 'random'])\n+    ap.add_argument('--model', default='fm', choices=['pop', 'fm', 'fm_listwise', 'fm_hybrid', 'random'])\n     ap.add_argument('--k', type=int, default=16)\n     ap.add_argument('--lr', type=float, default=0.001)\n     ap.add_argument('--epochs', type=int, default=40)\n     ap.add_argument('--seed', type=int, default=0)\n     ap.add_argument('--lw_alpha', type=float, default=0.3,\n                     help='weight of the pointwise BCE term mixed into fm_listwise loss')\n+    ap.add_argument('--lw', type=float, default=0.3,\n+                    help='weight of the listwise term added to full BCE in fm_hybrid loss')\n     ap.add_argument('--cap', type=int, default=64,\n                     help='max rows per user group in a listwise batch (subsampled if exceeded)')\n     ap.add_argument('--final', action='store_true',\n@@ -252,7 +289,10 @@\n                                    report_test=a.final),\n            'fm_listwise': lambda s: run_fm_listwise(s, k=a.k, lr=a.lr, epochs=a.epochs,\n                                                      seed=a.seed, report_test=a.final,\n-                                                     lw_alpha=a.lw_alpha, cap=a.cap)}[a.model](splits)\n+                                                     lw_alpha=a.lw_alpha, cap=a.cap),\n+           'fm_hybrid': lambda s: run_fm_hybrid(s, k=a.k, lr=a.lr, epochs=a.epochs,\n+                                                seed=a.seed, report_test=a.final,\n+                                                lw=a.lw, cap=a.cap)}[a.model](splits)\n     print(f\"\\n=== {a.model} (seed={a.seed}) ===\")\n     for sp in (('valid', 'test') if a.final else ('valid',)):\n         r = res[sp]\n", "provenance": "agent"}, "hash": "3a262787352dea17d679b21893d23e60d5018f92a2b8bb3eb1aecc45805cdc1d"}
