{"seq": 5, "ts": "2026-08-31T01:27:54Z", "type": "iteration", "prev_hash": "3a262787352dea17d679b21893d23e60d5018f92a2b8bb3eb1aecc45805cdc1d", "payload": {"iteration": 3, "hypothesis": "Adding a small within-user pairwise (BPR) hinge/logistic term on top of the pointwise BCE objective — with the pairwise weight lambda tuned to a modest value (0.3) and pairs sampled only inside mixed-label users — raises validation primary by more than 0.002 over the pointwise baseline.", "mechanism": "GAUC is a Mann-Whitney U statistic over within-user score differences; BPR's gradient is a direct, unbiased surrogate for exactly that quantity, whereas BCE only optimizes it indirectly through calibrated absolute probabilities. Unlike the listwise softmax (which normalizes over the whole short list and therefore heavily weights lists of length 1-3 where the metric is nearly saturated), BPR weights each user by its positive x negative pair count, which is close to the official GAUC weighting (positives from mixed users). Keeping BCE at full weight preserves the representation the pointwise run learned; the pairwise term only re-shapes the within-user ordering on top of it.", "predicted": "+0.003 to +0.006 valid primary (0.6045-0.6075); a null result is anything under +0.002", "invalid_if": "valid primary with pair_weight=0.3 lands within +/-0.002 of 0.60147, or below it, indicating the pointwise objective already captures the within-user ordering the FM can express.", "evidence": ["Organizer's judged #1 headroom item is loss/objective mismatch: training is pointwise logloss, metric is a within-user ranking metric (packet §5.1).", "iter 1: a pure within-user listwise softmax scored -0.00233, i.e. replacing the pointwise signal entirely loses information (the pointwise loss also fits the global positive rate that GAUC's per-user AUC still benefits from through shared embeddings).", "iter 2 hybrid listwise was INCONCLUSIVE (no delta reported), so the hybrid family is unmeasured, not refuted.", "C9: 57.778% of validation users are mixed-label and hold 78.907% of rows; only these users generate valid pairs and only these users contribute to GAUC.", "C2: within-user ranking means only score differences inside a user matter, which is exactly what a pairwise gradient sees."], "verdict": "REVERT", "reason": "With lambda=0.3 the pairwise term moved valid primary to 0.60008, a -0.00139 delta that is beyond the ~0.0005 noise floor and clearly below the +0.002 bar the hypothesis set. Decisively, GAUC itself fell (0.66509 vs 0.6674) — BPR failed to improve the very Mann-Whitney quantity it directly optimizes, so this is a real refutation of the claimed mechanism, not a wash.", "mechanism_update": "The pointwise BCE optimum already sits at (or past) the best within-user ordering this 5-field FM can express; the objective is not the binding constraint. Adding a within-user pairwise gradient does not expose new orderings the FM lacks capacity to represent — it only perturbs the shared V/W away from the BCE solution, degrading both GAUC and nDCG. The bottleneck is representational (user_id x video_id already captures the learnable signal), not the loss surrogate.", "deprioritise": ["pairwise/BPR objectives on the plain 5-field FM", "listwise/objective-swap variants that keep the same feature set, since the earlier listwise attempt and this share the 'objective is the bottleneck' premise the data now argues against"], "metrics": {"GAUC": 0.6650891304016113, "nDCG@5": 0.5350769758224487, "primary": 0.60008305311203, "users": 22377.0, "rows": 124909.0}, "delta_vs_parent": -0.0013864636421203613, "accept_bar": 0.0014, "confirmation": null, "seconds": 70.51, "config": {"model": "fm_bpr", "pair_weight": 0.3, "pair_bs": 8192, "lr": 0.001, "k": 16}, "seeds": [0], "diff": "--- a/pipeline/model.py\n+++ b/pipeline/model.py\n@@ -8,6 +8,11 @@\n             # group_ends: 1D int array of exclusive end offsets into X/y marking each\n             # user group (e.g. [3, 3, 5] means groups [0:3], [3:3] (empty, skipped),\n             # [3:5]). Within-group softmax (ListNet top-1) mixed with lw_alpha * BCE.\n+        .step_pair(Xp, Xn, weight=1.0) -> loss:float\n+            # One within-user BPR minibatch. Xp/Xn are aligned feature rows of a sampled\n+            # (positive, negative) pair from the SAME user. Loss = -log sigmoid(s_pos -\n+            # s_neg). The scalar bias b cancels in the score difference, so it is not\n+            # updated here. `weight` scales the pairwise gradient (lambda).\n         .predict(X, bs=200_000) -> np.ndarray[float]   # scores; higher = more relevant\n         .V, .W, .b                     # used by train.py to save/restore the best checkpoint\n \"\"\"\n@@ -33,18 +38,23 @@\n         inter = 0.5 * ((S ** 2).sum(1) - (E ** 2).sum((1, 2)))\n         return self.b + self.W[X].sum(1) + inter, E, S\n \n-    def _apply_grad(self, X, g, S, E):\n-        \"\"\"Shared Adam update given per-row dLoss/dlogit values g.\"\"\"\n-        gV = np.zeros_like(self.V); gW = np.zeros_like(self.W)\n-        np.add.at(gW, X, g[:, None])\n-        np.add.at(gV, X, g[:, None, None] * (S[:, None, :] - E))\n-        gV += self.l2 * self.V; gW += self.l2 * self.W\n+    def _adam_VW(self, gV, gW):\n+        \"\"\"One Adam step on V and W only (shared moment buffers). b is handled by the\n+        caller when it is part of the objective; for BPR it cancels and is skipped.\"\"\"\n         self.t += 1\n         b1, b2, eps = 0.9, 0.999, 1e-8\n         for P, G, M, Vv in ((self.V, gV, self.mV, self.vV), (self.W, gW, self.mW, self.vW)):\n             M *= b1; M += (1 - b1) * G\n             Vv *= b2; Vv += (1 - b2) * (G * G)\n             P -= self.lr * (M / (1 - b1 ** self.t)) / (np.sqrt(Vv / (1 - b2 ** self.t)) + eps)\n+\n+    def _apply_grad(self, X, g, S, E):\n+        \"\"\"Shared Adam update given per-row dLoss/dlogit values g (also updates b).\"\"\"\n+        gV = np.zeros_like(self.V); gW = np.zeros_like(self.W)\n+        np.add.at(gW, X, g[:, None])\n+        np.add.at(gV, X, g[:, None, None] * (S[:, None, :] - E))\n+        gV += self.l2 * self.V; gW += self.l2 * self.W\n+        self._adam_VW(gV, gW)\n         self.b -= self.lr * g.sum()\n \n     def step(self, X, y):\n@@ -53,6 +63,27 @@\n         g = ((sigmoid(z) - y) / B).astype(np.float32)    # (B,)\n         self._apply_grad(X, g, S, E)\n         return float(-np.mean(y * np.log(sigmoid(z) + 1e-9) + (1 - y) * np.log(1 - sigmoid(z) + 1e-9)))\n+\n+    def step_pair(self, Xp, Xn, weight=1.0):\n+        \"\"\"Within-user BPR minibatch. Xp/Xn are aligned (positive, negative) feature\n+        rows sampled from the same user. Loss = -log sigmoid(s_pos - s_neg). The bias b\n+        cancels in the difference, so only V/W are updated. Gradients from the positive\n+        and negative rows are accumulated into one Adam step.\"\"\"\n+        B = len(Xp)\n+        zp, Ep, Sp = self.logits(Xp)\n+        zn, En, Sn = self.logits(Xn)\n+        diff = zp - zn\n+        sig = sigmoid(diff)\n+        coef = ((1.0 - sig) / B).astype(np.float32)      # magnitude of dLoss/ddiff\n+        gp = (-coef * weight).astype(np.float32)          # dLoss/ds_pos\n+        gn = (coef * weight).astype(np.float32)           # dLoss/ds_neg\n+        gV = np.zeros_like(self.V); gW = np.zeros_like(self.W)\n+        np.add.at(gW, Xp, gp[:, None]); np.add.at(gW, Xn, gn[:, None])\n+        np.add.at(gV, Xp, gp[:, None, None] * (Sp[:, None, :] - Ep))\n+        np.add.at(gV, Xn, gn[:, None, None] * (Sn[:, None, :] - En))\n+        gV += self.l2 * self.V; gW += self.l2 * self.W\n+        self._adam_VW(gV, gW)\n+        return float(np.mean(-np.log(sig + 1e-9)))\n \n     def step_list(self, X, y, group_ends, lw_alpha=0.3):\n         \"\"\"Within-user listwise softmax (ListNet top-1), mixed with pointwise BCE.\n--- a/pipeline/train.py\n+++ b/pipeline/train.py\n@@ -2,6 +2,7 @@\n (batching, epochs, early stopping, multi-task orchestration). See AGENT_RULES.md.\n   --model pop          : item popularity (official baseline; pure statistics, no training)\n   --model fm           : Factorization Machine, pointwise BCE (the starting model)\n+  --model fm_bpr       : same FM, pointwise BCE + within-user BPR pairwise term (lambda)\n   --model fm_listwise  : same FM, within-user listwise softmax (ListNet top-1) + BCE mix\n   --model random       : random scores (lower bound; self-check that the evaluator is intact)\n numpy only. Usage: see README.md\n@@ -77,6 +78,89 @@\n         out['test'] = evaluate(ute, yte, m.predict(Xte))\n     return out\n \n+# ---------------- pairwise (BPR) helpers ----------------\n+def _build_pair_index(users, y):\n+    \"\"\"Build, ONCE from train labels, the per-user positive/negative row-index pools for\n+    mixed-label users only. Returns flat arrays + per-user (start, len) slices plus a\n+    sampling weight proportional to pos_count * neg_count -- i.e. uniform over all\n+    within-user (pos, neg) pairs, which weights each user close to the official GAUC\n+    weighting (positives from mixed users).\"\"\"\n+    by_user = collections.defaultdict(list)\n+    for i, u in enumerate(users):\n+        by_user[u].append(i)\n+    pos_lists, neg_lists, weights = [], [], []\n+    for u, idxs in by_user.items():\n+        idxs = np.array(idxs, dtype=np.int64)\n+        yi = y[idxs]\n+        p = idxs[yi > 0.5]; n = idxs[yi <= 0.5]\n+        if len(p) and len(n):\n+            pos_lists.append(p); neg_lists.append(n); weights.append(len(p) * len(n))\n+    if not weights:\n+        return None\n+    pos_all = np.concatenate(pos_lists); neg_all = np.concatenate(neg_lists)\n+    pos_len = np.array([len(p) for p in pos_lists], dtype=np.int64)\n+    neg_len = np.array([len(p) for p in neg_lists], dtype=np.int64)\n+    pos_start = np.concatenate([[0], np.cumsum(pos_len)[:-1]]).astype(np.int64)\n+    neg_start = np.concatenate([[0], np.cumsum(neg_len)[:-1]]).astype(np.int64)\n+    w = np.array(weights, dtype=np.float64); w /= w.sum()\n+    return dict(pos_all=pos_all, neg_all=neg_all, pos_start=pos_start, neg_start=neg_start,\n+                pos_len=pos_len, neg_len=neg_len, w=w, n_users=len(weights))\n+\n+def _sample_pairs(pix, n, rng):\n+    \"\"\"Sample n within-user (pos_idx, neg_idx) pairs, fully vectorized.\"\"\"\n+    us = rng.choice(pix['n_users'], size=n, p=pix['w'])\n+    off_p = (rng.random(n) * pix['pos_len'][us]).astype(np.int64)\n+    off_n = (rng.random(n) * pix['neg_len'][us]).astype(np.int64)\n+    ip = pix['pos_all'][pix['pos_start'][us] + off_p]\n+    inn = pix['neg_all'][pix['neg_start'][us] + off_n]\n+    return ip, inn\n+\n+def _train_fm_bpr(enc, dim, k, lr, epochs, bs, patience, seed, verbose, pair_weight,\n+                  pair_bs):\n+    \"\"\"Pointwise BCE epoch loop (unchanged) with a within-user BPR pairwise minibatch\n+    applied after each pointwise minibatch, scaled by pair_weight. Selection/early\n+    stopping on valid primary. Returns the fitted, best-checkpointed model.\"\"\"\n+    Xtr, ytr, utr = enc['train']; Xva, yva, uva = enc['valid']\n+    pix = _build_pair_index(utr, ytr)\n+    m = FM(dim, k=k, lr=lr, seed=seed)\n+    rng = np.random.default_rng(seed)\n+    best, best_state, bad = -1, None, 0\n+    for ep in range(1, epochs + 1):\n+        idx = rng.permutation(len(ytr)); t0 = time.time()\n+        losses = []\n+        for i in range(0, len(idx), bs):\n+            b = idx[i:i + bs]\n+            losses.append(m.step(Xtr[b], ytr[b]))\n+            if pix is not None and pair_weight > 0:\n+                ip, inn = _sample_pairs(pix, pair_bs, rng)\n+                m.step_pair(Xtr[ip], Xtr[inn], weight=pair_weight)\n+        va = evaluate(uva, yva, m.predict(Xva))\n+        if verbose:\n+            print(f\"  epoch {ep:2d} | loss {np.mean(losses):.4f} | valid GAUC {va['GAUC']:.4f} \"\n+                  f\"nDCG@5 {va['nDCG@5']:.4f} primary {va['primary']:.4f} | {time.time()-t0:.1f}s\")\n+        if va['primary'] > best + 1e-5:\n+            best, bad = va['primary'], 0\n+            best_state = (m.V.copy(), m.W.copy(), np.float32(m.b))\n+        else:\n+            bad += 1\n+            if bad >= patience:\n+                if verbose: print(f\"  early stop at epoch {ep}\")\n+                break\n+    m.V, m.W, m.b = best_state\n+    return m\n+\n+def run_fm_bpr(splits, k=16, lr=0.001, epochs=40, bs=8192, patience=4, seed=0,\n+               verbose=True, report_test=False, pair_weight=0.3, pair_bs=8192):\n+    enc, dim = encode(splits)\n+    Xva, yva, uva = enc['valid']\n+    m = _train_fm_bpr(enc, dim, k, lr, epochs, bs, patience, seed, verbose, pair_weight,\n+                      pair_bs)\n+    out = {'valid': evaluate(uva, yva, m.predict(Xva))}\n+    if report_test:\n+        Xte, yte, ute = enc['test']\n+        out['test'] = evaluate(ute, yte, m.predict(Xte))\n+    return out\n+\n # ---------------- listwise batching helpers ----------------\n def _group_rows_by_user(users):\n     \"\"\"users: list-like aligned to X/y rows -> dict user -> np.array of row indices.\"\"\"\n@@ -152,7 +236,8 @@\n \n # ---------------- harness contract ----------------\n def fit_predict(enc, dim, model='fm', k=16, lr=0.001, epochs=40, bs=8192, patience=4,\n-                seed=0, verbose=False, lw_alpha=0.3, cap=64):\n+                seed=0, verbose=False, lw_alpha=0.3, cap=64, pair_weight=0.3,\n+                pair_bs=8192):\n     \"\"\"Train on `train` and return raw scores for every split.\n \n     THE HARNESS CALLS THIS. `run_fm`/`run_fm_listwise` above return metrics only, which\n@@ -182,6 +267,11 @@\n     if model == 'random':\n         rng = np.random.default_rng(seed)\n         return {sp: rng.random(len(enc[sp][1])) for sp in enc}\n+\n+    if model == 'fm_bpr':\n+        m = _train_fm_bpr(enc, dim, k, lr, epochs, bs, patience, seed, verbose,\n+                          pair_weight, pair_bs)\n+        return {sp: m.predict(enc[sp][0]) for sp in enc}\n \n     if model == 'fm_listwise':\n         user_to_idx = _group_rows_by_user(utr)\n@@ -231,7 +321,7 @@\n     ap = argparse.ArgumentParser()\n     ap.add_argument('--data_dir', default='./KuaiRand-Pure/data',\n                     help='the extracted KuaiRand-Pure data directory')\n-    ap.add_argument('--model', default='fm', choices=['pop', 'fm', 'fm_listwise', 'random'])\n+    ap.add_argument('--model', default='fm', choices=['pop', 'fm', 'fm_bpr', 'fm_listwise', 'random'])\n     ap.add_argument('--k', type=int, default=16)\n     ap.add_argument('--lr', type=float, default=0.001)\n     ap.add_argument('--epochs', type=int, default=40)\n@@ -240,6 +330,10 @@\n                     help='weight of the pointwise BCE term mixed into fm_listwise loss')\n     ap.add_argument('--cap', type=int, default=64,\n                     help='max rows per user group in a listwise batch (subsampled if exceeded)')\n+    ap.add_argument('--pair_weight', type=float, default=0.3,\n+                    help='lambda: weight of the within-user BPR pairwise term in fm_bpr')\n+    ap.add_argument('--pair_bs', type=int, default=8192,\n+                    help='number of within-user (pos,neg) pairs per pairwise minibatch')\n     ap.add_argument('--final', action='store_true',\n                     help='also score and print test (final report only; never while iterating)')\n     a = ap.parse_args()\n@@ -250,6 +344,9 @@\n            'random': lambda s: run_random(s, a.seed, report_test=a.final),\n            'fm': lambda s: run_fm(s, k=a.k, lr=a.lr, epochs=a.epochs, seed=a.seed,\n                                    report_test=a.final),\n+           'fm_bpr': lambda s: run_fm_bpr(s, k=a.k, lr=a.lr, epochs=a.epochs, seed=a.seed,\n+                                          report_test=a.final, pair_weight=a.pair_weight,\n+                                          pair_bs=a.pair_bs),\n            'fm_listwise': lambda s: run_fm_listwise(s, k=a.k, lr=a.lr, epochs=a.epochs,\n                                                      seed=a.seed, report_test=a.final,\n                                                      lw_alpha=a.lw_alpha, cap=a.cap)}[a.model](splits)\n", "note": "Added FM.step_pair (within-user BPR logistic loss, updating only V/W since bias cancels in the score difference) and a 'fm_bpr' training path that keeps the pointwise BCE epoch loop intact but applies one vectorized-sampled pairwise minibatch (pairs drawn from mixed-label train users, weighted by pos*neg to approximate GAUC weighting) after each pointwise batch, scaled by pair_weight=0.3. Early stopping and best-checkpoint selection remain on valid primary; fit_predict gained the matching branch so the harness builds submissions from this pipeline.", "provenance": "agent", "cost_so_far_usd": 2.3281}, "hash": "3d17e5a99a502a08301fd3db5d084ad97ed9bc605684b560e1099dbcb7c98317"}
