{"seq": 0, "ts": "2026-08-31T19:37:26Z", "type": "RUN_START", "prev_hash": "0000000000000000000000000000000000000000000000000000000000000000", "payload": {"run_id": "run_20260831T193724Z", "dry_run": false, "workspace_hash": "cee82cc6d9f3aedcc436b714000e4862ddf42131b7bfe03404a4b60b87adc74a", "limits": {"max_iterations": 50, "wall_clock_s": 21600, "eps": 0.002, "N": 3, "accept_bar": 0.0014}, "model": "claude-opus-4-8", "budget_usd_ceiling": 14.0}, "hash": "5a970757ec690eaa15255a3d0b24952d5412c2917f471e4245181ff9307d590f"}
{"seq": 1, "ts": "2026-08-31T19:39:40Z", "type": "iteration", "prev_hash": "5a970757ec690eaa15255a3d0b24952d5412c2917f471e4245181ff9307d590f", "payload": {"iteration": 0, "hypothesis": "reproduce the official baseline", "verdict": "KEEP", "metrics": {"GAUC": 0.6681015491485596, "nDCG@5": 0.536270022392273, "primary": 0.6021857857704163, "users": 22377.0, "rows": 124909.0}, "delta_vs_parent": 0.0, "seconds": 133.52, "config": {}, "diff": "", "provenance": "harness"}, "hash": "86c973df5709df214c686c8c09a9e829a490e87c698cf840267c1cc31abe0d94"}
