{"seq": 3, "ts": "2026-08-31T19:57:25Z", "type": "error_recovery", "prev_hash": "b8e92865f26c6180181528ebdb13f709ad3c289134057aa156d2ed478640ec59", "payload": {"iteration": 2, "failure": "contract", "attempt": 1, "timed_out": false, "orphan_free": true, "kill_note": "", "seconds": 41.09, "stderr": "Traceback (most recent call last):\n  File \"<frozen runpy>\", line 198, in _run_module_as_main\n  File \"<frozen runpy>\", line 88, in _run_code\n  File \"C:\\Users\\nicho\\OneDrive\\Documents\\Hackathon\\kuairand-starter-kit\\harness\\run_node.py\", line 92, in <module>\n    main()\n    ~~~~^^\n  File \"C:\\Users\\nicho\\OneDrive\\Documents\\Hackathon\\kuairand-starter-kit\\harness\\run_node.py\", line 36, in main\n    enc, dim = load_encoded()\n               ~~~~~~~~~~~~^^\n  File \"C:\\Users\\nicho\\OneDrive\\Documents\\Hackathon\\kuairand-starter-kit\\harness\\cache.py\", line 105, in load_encoded\n    for sp, (X, y, u) in enc.items():\n            ^^^^^^^^^\nValueError: not enough values to unpack (expected 3, got 2)\n", "hypothesis": "Replacing the binary within-user softmax target with a graded target that gives long_view rows weight 1.0 and click-only rows weight w=0.25 (and admitting every group whose graded target is non-uniform) raises validation primary by more than 0.002 over the current best node, because it restores training gradient from the ~40% of user lists that the mixed-label-only filter currently discards.", "action": "returned to the coder with the traceback"}, "hash": "742b88a854ad78b444eeaa540adca3100188cb95e0a1ad4209c8a54d059edb90"}
{"seq": 4, "ts": "2026-08-31T20:00:37Z", "type": "error_recovery", "prev_hash": "742b88a854ad78b444eeaa540adca3100188cb95e0a1ad4209c8a54d059edb90", "payload": {"iteration": 2, "failure": "contract", "timed_out": false, "orphan_free": true, "kill_note": "", "seconds": 42.4, "stderr": "Traceback (most recent call last):\n  File \"<frozen runpy>\", line 198, in _run_module_as_main\n  File \"<frozen runpy>\", line 88, in _run_code\n  File \"C:\\Users\\nicho\\OneDrive\\Documents\\Hackathon\\kuairand-starter-kit\\harness\\run_node.py\", line 92, in <module>\n    main()\n    ~~~~^^\n  File \"C:\\Users\\nicho\\OneDrive\\Documents\\Hackathon\\kuairand-starter-kit\\harness\\run_node.py\", line 55, in main\n    p = fit_predict(enc, dim, seed=s, **cfg)\n  File \"C:\\Users\\nicho\\OneDrive\\Documents\\Hackathon\\kuairand-starter-kit\\pipeline\\train.py\", line 339, in fit_predict\n    m.step_listwise_graded(Xb, gb, offs)\n    ^^^^^^^^^^^^^^^^^^^^^^\nAttributeError: 'FM' object has no attribute 'step_listwise_graded'\n", "hypothesis": "Replacing the binary within-user softmax target with a graded target that gives long_view rows weight 1.0 and click-only rows weight w=0.25 (and admitting every group whose graded target is non-uniform) raises validation primary by more than 0.002 over the current best node, because it restores training gradient from the ~40% of user lists that the mixed-label-only filter currently discards.", "action": "node pruned"}, "hash": "8992130c077fc04936c395e7b703a9d0f29de84001767456f945fd509c91d87b"}
{"seq": 5, "ts": "2026-08-31T20:00:45Z", "type": "iteration", "prev_hash": "8992130c077fc04936c395e7b703a9d0f29de84001767456f945fd509c91d87b", "payload": {"iteration": 2, "hypothesis": "Replacing the binary within-user softmax target with a graded target that gives long_view rows weight 1.0 and click-only rows weight w=0.25 (and admitting every group whose graded target is non-uniform) raises validation primary by more than 0.002 over the current best node, because it restores training gradient from the ~40% of user lists that the mixed-label-only filter currently discards.", "verdict": "INCONCLUSIVE", "reason": "The run never produced a validation number: FM has no step_listwise_graded method, so the graded softmax gradient was never computed. This is a missing-method wiring bug in model.py, not a statement about graded targets. invalid_if was never evaluated because the mechanism never ran.", "metrics": null, "delta_vs_parent": null, "failure": "contract", "seconds": 42.4, "config": {"model": "fm_listwise_graded", "aux_weight": 0.25}, "diff": "--- a/pipeline/features.py\n+++ b/pipeline/features.py\n@@ -37,11 +37,12 @@\n FIELDS is not documentation: len(FIELDS) sizes vocabs and the second dimension of X. Add a\n column to raw() and you must register its name in FIELDS, or the shapes will not match.\n \n-This iteration also exposes a parallel dict entry enc['click'] = {split: float32 array} --\n-is_click sourced through harness.adapter.auxiliary_targets (a permitted AUXILIARY target,\n-never a same-row input, never a column of X). train.py turns it into a graded relevance\n-target for the listwise-graded objective. It is keyed under 'click', not a split name, so\n-it is never mistaken for an (X, y, users) tuple.\n+The listwise-graded objective needs is_click as a graded relevance signal. is_click is a\n+permitted AUXILIARY target (never a same-row input, never a column of X). Because the\n+harness cache unpacks every enc entry as an (X, y, users) tuple, this file MUST NOT add a\n+non-tuple entry to enc -- train.py fetches is_click directly through\n+harness.adapter.auxiliary_targets, which returns arrays aligned 1:1 with each split's rows\n+in exactly the order encode() iterates them here.\n \"\"\"\n import numpy as np\n \n@@ -89,12 +90,6 @@\n                          f\"targets; history features must come from other rows)\")\n     return x[IDX[name]]\n \n-def _extract_click(entry):\n-    \"\"\"auxiliary_targets may hand back {split: {col: arr}} or {split: arr}; accept both.\"\"\"\n-    if isinstance(entry, dict):\n-        return np.asarray(entry['is_click'], dtype=np.float32)\n-    return np.asarray(entry, dtype=np.float32)\n-\n def encode(splits):\n     \"\"\"Map categorical features to contiguous ids. Unseen values fall into the field's\n     UNK slot. Bucket edges may be fitted on splits['train'] only, never valid/test.\n@@ -103,13 +98,11 @@\n     user's strictly-earlier long_view behaviour, sourced through harness.history so the\n     ordering is correct and no test outcome ever enters an aggregate.\n \n-    is_click is fetched as an AUXILIARY target through harness.adapter and stored under\n-    enc['click'] (a parallel dict entry, aligned 1:1 with each split's rows). It is never\n-    a column of X and never a same-row input -- train.py only uses it to grade the\n-    listwise softmax target for OTHER-row-independent group ordering.\n+    enc[name] is always an (X, y, users) tuple -- nothing else -- because the harness\n+    cache unpacks every entry that way. The graded objective's is_click signal is fetched\n+    in train.py through harness.adapter, aligned to the same row order produced here.\n     \"\"\"\n     from harness.history import prior_stats, bucketize\n-    from harness.adapter import auxiliary_targets\n \n     tr = splits['train']\n     edges = _bucket_edges([same_row(x, 'duration_ms') for x in tr])\n@@ -173,7 +166,4 @@\n             X[:, 5 + j] = col + offsets[5 + j]\n         enc[name] = (X, y, users)\n \n-    # ---- auxiliary is_click, positionally aligned (adapter refuses test rows) ----\n-    aux = auxiliary_targets(('is_click',))\n-    enc['click'] = {name: _extract_click(aux[name]) for name in splits if name in aux}\n     return enc, int(sum(all_dims))\n--- a/pipeline/train.py\n+++ b/pipeline/train.py\n@@ -228,10 +228,25 @@\n         out['test'] = evaluate(ute, yte, m.predict(Xte))\n     return out\n \n+def _fetch_click(split):\n+    \"\"\"is_click for one split, aligned 1:1 with encode()'s row order for that split.\n+\n+    is_click is a permitted AUXILIARY target: harness.adapter.auxiliary_targets sources\n+    it and refuses test rows, and it is never a same-row input or a column of X. Fetched\n+    here (not stored in enc) because the harness cache unpacks every enc entry as an\n+    (X, y, users) tuple -- a non-tuple entry breaks it. The adapter aligns positionally\n+    to kit.data.load()'s split, which is exactly the order encode() iterates.\n+    \"\"\"\n+    from harness.adapter import auxiliary_targets\n+    aux = auxiliary_targets(('is_click',))\n+    entry = aux[split]\n+    arr = entry['is_click'] if isinstance(entry, dict) else entry\n+    return np.asarray(arr, dtype=np.float32)\n+\n def _graded_target(ytr, click, aux_weight):\n     \"\"\"long_view -> 1.0, click-only -> aux_weight, otherwise 0.0. Reads the label only\n     as a TARGET (train.py is the legitimate place to touch IDX['label'] / y); click is a\n-    permitted auxiliary target from features.py's enc['click'], never a same-row input.\"\"\"\n+    permitted auxiliary target, never a same-row input.\"\"\"\n     return np.where(ytr > 0, np.float32(1.0),\n                     np.where(click > 0, np.float32(aux_weight),\n                              np.float32(0.0))).astype(np.float32)\n@@ -244,7 +259,7 @@\n     trains the shared item/author/tab embeddings and the prior-aggregate crosses.\"\"\"\n     enc, dim = encode(splits)\n     Xtr, ytr, utr = enc['train']; Xva, yva, uva = enc['valid']\n-    g_tr = _graded_target(ytr, enc['click']['train'], aux_weight)\n+    g_tr = _graded_target(ytr, _fetch_click('train'), aux_weight)\n     m = FM(dim, k=k, lr=lr, seed=seed)\n     rng = np.random.default_rng(seed)\n     best, best_state, bad = -1, None, 0\n@@ -292,8 +307,8 @@\n     \"\"\"\n     Xtr, ytr, utr = enc['train']\n     Xva, yva, uva = enc['valid']\n-    # enc also carries a non-split 'click' dict entry; only the (X, y, users) tuples are\n-    # real splits to emit scores for.\n+    # Every enc entry is an (X, y, users) tuple (harness cache requires it); the graded\n+    # click signal is fetched separately through the adapter.\n     data_splits = [sp for sp in enc if isinstance(enc[sp], tuple)]\n \n     if model == 'pop':\n@@ -314,7 +329,7 @@\n     if model == 'fm_listwise_graded':\n         # This iteration's objective: graded softmax target. The banked pure-binary\n         # objective stays available under `fm_listwise_pure` for a fast rollback.\n-        g_tr = _graded_target(ytr, enc['click']['train'], aux_weight)\n+        g_tr = _graded_target(ytr, _fetch_click('train'), aux_weight)\n         m = FM(dim, k=k, lr=lr, seed=seed)\n         rng = np.random.default_rng(seed)\n         best, best_state, bad = -1, None, 0\n", "provenance": "agent"}, "hash": "dcd7bd982e4af1d393c2b0b14a0f9305fdc261b0ee5a8ddad2703823f7adc7eb"}
{"seq": 6, "ts": "2026-08-31T20:01:24Z", "type": "iteration", "prev_hash": "dcd7bd982e4af1d393c2b0b14a0f9305fdc261b0ee5a8ddad2703823f7adc7eb", "payload": {"iteration": 3, "provenance": "harness", "hypothesis": "Rank-averaging the 2 best distinct candidates decorrelates their errors.", "mechanism": "An ensemble buys decorrelation, not strength; a member that is individually weaker can still help.", "verdict": "INCONCLUSIVE", "reason": "ensemble of iterations 1,0", "metrics": {"GAUC": 0.6766641139984131, "nDCG@5": 0.5406190752983093, "primary": 0.6086416244506836, "users": 22377.0, "rows": 124909.0}, "delta_vs_parent": -0.004745006561279297, "accept_bar": 0.0014, "seconds": 1.13, "config": {}, "diff": "", "ensemble_members": [1, 0], "cost_so_far_usd": 2.8845}, "hash": "58d5557ba8d3f50b79a46b875f2a9a5138344c1c9500cc1b21613631f04d4f61"}
{"seq": 7, "ts": "2026-08-31T20:05:36Z", "type": "proposal_reject", "prev_hash": "58d5557ba8d3f50b79a46b875f2a9a5138344c1c9500cc1b21613631f04d4f61", "payload": {"iteration": 4, "reason": "candidate 2 is missing proposed_change"}, "hash": "3820baa39c2c80d90c43f4223703c643f55bc352a5c7fd6f32e2e59ccafef2fb"}
{"seq": 8, "ts": "2026-08-31T20:15:25Z", "type": "iteration", "prev_hash": "3820baa39c2c80d90c43f4223703c643f55bc352a5c7fd6f32e2e59ccafef2fb", "payload": {"iteration": 4, "hypothesis": "The listwise arm is under-trained, not under-featured: with a smaller learning rate, more patience and larger user-grouped batches it will run past epoch 3-4 and gain more than +0.002 validation primary over the current best.", "mechanism": "Grouped batches make the gradient estimate correlated within a user, raising gradient variance per step; combined with positives-normalisation the effective step is too large, so validation primary peaks after 3 epochs before the FM embeddings for mid-frequency videos are fitted. Slower steps with more users per batch let the within-user score differences for long lists (where all GAUC weight lives) keep refining, which reorders those lists.", "predicted": "", "invalid_if": "The best epoch stays at 3-5 under the slower schedule and validation primary moves by less than 0.001 -- that means the early stop is real overfitting, not an oversized step.", "evidence": ["Controlled ablation note: the grouped pointwise arm ran to epochs 8/11/10 while listwise stopped at 3/4/4 -- the ranking arm halts 2-3x earlier.", "Registry: user-grouped batching alone costs -0.00239 with the loss held pointwise, larger than the +0.00162 listwise-over-baseline gain.", "The winning implementation normalises the loss by total positives in the batch, so effective step size scales with positives/rows and is not comparable to the pointwise lr=0.001 that was tuned for it.", "data_profile §12: lr=0.0005 and lr=0.0003 were the best pointwise settings (0.60178/0.60179 vs 0.60144 at lr=0.001)."], "verdict": "REVERT", "reason": "Predicted >+0.002 from slower/larger-batch training; got +0.00065, ~1.3 sigma and below the 0.001 evidence threshold. This lands squarely in the invalid_if region: the early peak is real convergence, not an oversized step, so slowing the schedule does not unlock the mid-frequency-video refinement the mechanism posited.", "mechanism_update": "The listwise arm's short best-epoch is not under-training. Grouped-batch gradient variance plus positives-normalisation is not what caps it; the objective converges to roughly this validation level and additional steps only refine within noise. The remaining gap to oracle is not addressable by schedule tuning on the same features/objective.", "deprioritise": ["slower learning rate / larger user-grouped batches / more patience as a lever on the listwise arm", "the under-training explanation of the listwise early-stop"], "metrics": {"GAUC": 0.6834660172462463, "nDCG@5": 0.5446147918701172, "primary": 0.6140403747558594, "users": 22377.0, "rows": 124909.0}, "delta_vs_parent": 0.0006537437438964844, "accept_bar": 0.0014, "confirmation": {"seeds": [0, 1, 2], "paired_deltas": [0.001122, 0.000919, 0.001327], "mean_delta": 0.0011224150657653809, "worst_delta": 0.0009185075759887695, "all_paired_positive": true, "ensemble_delta": 0.0006537437438964844, "basis": "paired_per_seed"}, "seconds": 480.11, "config": {"model": "fm_listwise_pure", "lr": 0.0005, "bs": 32768, "patience": 8, "epochs": 40}, "seeds": [0, 1, 2], "diff": "--- a/pipeline/train.py\n+++ b/pipeline/train.py\n@@ -187,7 +187,7 @@\n         out['test'] = evaluate(ute, yte, m.predict(Xte))\n     return out\n \n-def run_fm_listwise_pure(splits, k=16, lr=0.001, epochs=40, bs=8192, patience=4, seed=0,\n+def run_fm_listwise_pure(splits, k=16, lr=0.0005, epochs=40, bs=32768, patience=8, seed=0,\n                          verbose=True, report_test=False):\n     \"\"\"Same FM capacity as run_fm, trained with the PURE within-user softmax\n     cross-entropy (FM.step_listwise): no BCE term mixed in, mixed-label groups only,\n@@ -195,12 +195,16 @@\n     user groups are packed into ~bs-row batches by _build_grouped_batches so a user is\n     never split across a batch boundary. Early stopping/model selection stay on valid\n     primary. This is the banked listwise objective; it pairs with the fit_predict\n-    `fm_listwise_pure` branch used to build the submission.\"\"\"\n+    `fm_listwise_pure` branch used to build the submission.\n+\n+    Schedule note (this iteration): lr 0.001->0.0005, bs 8192->32768, patience 4->8 to\n+    test whether the objective is under-trained rather than under-featured. best_ep is\n+    reported so the under-training hypothesis is directly checkable.\"\"\"\n     enc, dim = encode(splits)\n     Xtr, ytr, utr = enc['train']; Xva, yva, uva = enc['valid']\n     m = FM(dim, k=k, lr=lr, seed=seed)\n     rng = np.random.default_rng(seed)\n-    best, best_state, bad = -1, None, 0\n+    best, best_state, bad, best_ep = -1, None, 0, 0\n     for ep in range(1, epochs + 1):\n         t0 = time.time()\n         losses = []\n@@ -211,13 +215,14 @@\n             print(f\"  epoch {ep:2d} | loss {np.mean(losses):.4f} | valid GAUC {va['GAUC']:.4f} \"\n                   f\"nDCG@5 {va['nDCG@5']:.4f} primary {va['primary']:.4f} | {time.time()-t0:.1f}s\")\n         if va['primary'] > best + 1e-5:\n-            best, bad = va['primary'], 0\n+            best, bad, best_ep = va['primary'], 0, ep\n             best_state = (m.V.copy(), m.W.copy(), np.float32(m.b))\n         else:\n             bad += 1\n             if bad >= patience:\n                 if verbose: print(f\"  early stop at epoch {ep}\")\n                 break\n+    print(f\"  fm_listwise_pure seed={seed} best epoch {best_ep} valid primary {best:.5f}\", flush=True)\n     m.V, m.W, m.b = best_state\n     out = {'valid': evaluate(uva, yva, m.predict(Xva))}\n     if report_test:\n@@ -226,8 +231,8 @@\n     return out\n \n # ---------------- harness contract ----------------\n-def fit_predict(enc, dim, model='fm_listwise_pure', k=16, lr=0.001, epochs=40, bs=8192,\n-                patience=4, seed=0, verbose=False, lw_alpha=0.3, cap=64):\n+def fit_predict(enc, dim, model='fm_listwise_pure', k=16, lr=0.0005, epochs=40, bs=32768,\n+                patience=8, seed=0, verbose=False, lw_alpha=0.3, cap=64):\n     \"\"\"Train on `train` and return raw scores for every split.\n \n     THE HARNESS CALLS THIS. `run_fm`/`run_fm_listwise` above return metrics only, which\n@@ -237,6 +242,8 @@\n \n     Default model is `fm_listwise_pure`: the within-user softmax objective this\n     iteration is testing together with the strictly-prior user aggregates in features.py.\n+    This iteration also slows the schedule (lr 0.0005, bs 32768, patience 8) to test the\n+    under-training hypothesis; best epoch per seed is printed for the pure branch.\n \n     Contract, preserve it when you change the model or the loss:\n         fit_predict(enc, dim, ...) -> {'train': ndarray, 'valid': ndarray, 'test': ndarray}\n@@ -269,7 +276,7 @@\n         # tree in the first place.\n         m = FM(dim, k=k, lr=lr, seed=seed)\n         rng = np.random.default_rng(seed)\n-        best, best_state, bad = -1, None, 0\n+        best, best_state, bad, best_ep = -1, None, 0, 0\n         for ep in range(1, epochs + 1):\n             for (Xb, yb, offs) in _build_grouped_batches(Xtr, ytr, utr, target_bs=bs,\n                                                          rng=rng):\n@@ -278,12 +285,14 @@\n             if verbose:\n                 print(f\"  epoch {ep:2d} valid primary {p:.5f}\", flush=True)\n             if p > best + 1e-5:\n-                best, bad = p, 0\n+                best, bad, best_ep = p, 0, ep\n                 best_state = (m.V.copy(), m.W.copy(), np.float32(m.b))\n             else:\n                 bad += 1\n                 if bad >= patience:\n                     break\n+        print(f\"  fm_listwise_pure seed={seed} best epoch {best_ep} valid primary {best:.5f}\",\n+              flush=True)\n         m.V, m.W, m.b = best_state\n         return {sp: m.predict(enc[sp][0]) for sp in enc}\n \n@@ -358,8 +367,8 @@\n            'fm_listwise': lambda s: run_fm_listwise(s, k=a.k, lr=a.lr, epochs=a.epochs,\n                                                      seed=a.seed, report_test=a.final,\n                                                      lw_alpha=a.lw_alpha, cap=a.cap),\n-           'fm_listwise_pure': lambda s: run_fm_listwise_pure(s, k=a.k, lr=a.lr,\n-                                                              epochs=a.epochs, seed=a.seed,\n+           'fm_listwise_pure': lambda s: run_fm_listwise_pure(s, k=a.k, epochs=a.epochs,\n+                                                              seed=a.seed,\n                                                               report_test=a.final)}[a.model](splits)\n     print(f\"\\n=== {a.model} (seed={a.seed}) ===\")\n     for sp in (('valid', 'test') if a.final else ('valid',)):\n", "note": "Slowed the fm_listwise_pure optimisation schedule (lr 0.001->0.0005, bs 8192->32768, patience 4->8, epochs unchanged) in both fit_predict's defaults/branch and run_fm_listwise_pure, leaving the loss, features and grouped batching untouched. Added a per-seed best-epoch print so the under-training hypothesis is directly checkable; the CLI dispatch drops its explicit lr override so the new default schedule applies.", "provenance": "agent", "cost_so_far_usd": 3.8069}, "hash": "eadfd9032953315ccbb5819084dd4fa9cdc4419140f26911bdba11aa9f4dc21f"}
