{"seq": 9, "ts": "2026-08-31T20:38:33Z", "type": "iteration", "prev_hash": "eadfd9032953315ccbb5819084dd4fa9cdc4419140f26911bdba11aa9f4dc21f", "payload": {"iteration": 5, "hypothesis": "Adding a second within-user listwise softmax head on `is_click`, sharing the FM embedding table with the scored `long_view` head, raises validation primary by more than 0.0015 because it supplies ranking gradient for the ~42% of user groups that the pure long_view listwise loss skips entirely.", "mechanism": "Video/author/user embeddings are shared. Today they are fit only from the 58% of groups that are long_view-mixed; item embeddings for videos seen mainly by uniform users are trained on almost nothing. The aux click softmax reorders nothing by itself at inference (only the long_view head scores), but it moves the shared V so that item embeddings encode within-user discriminative structure learned from ~1.7x more eligible groups. Better item embeddings change the WITHIN-USER order of the mixed-label groups that carry 100% of GAUC weight and 78.9% of rows.", "predicted": "", "invalid_if": "aux_weight=0.3 gives a 3-seed mean delta below +0.0015 against the 0.61404 parent, or the long_view head's validation GAUC falls while nDCG@5 rises (classic seesaw) -- either observation refutes shared-embedding transfer from click here.", "evidence": ["The confirmed winner 50cebc5d897d restricts eligible groups to MIXED-LABEL users only, so all-positive and all-negative long_view groups contribute exactly zero gradient today.", "C9/data_profile: 30.3% of users are all-negative and 11.9% all-positive on long_view, i.e. 42.2% of user groups are currently dead weight in training.", "Train is_click mean 0.46345 vs long_view 0.33 with validation r=0.7515 -- click is denser than long_view and disagrees with it often enough that many long_view-uniform groups are click-mixed, so they become eligible under the aux head.", "multitask is UNTRIED in the registry and is the organizers' direction #3; auxiliary targets are explicitly legal (C4)."], "verdict": "REVERT", "reason": "The auxiliary click head moved validation primary by +0.00015, a third of one sigma on the paired noise floor (~0.0005) and far under the +0.0015 the hypothesis pre-registered as its success bar. This is indistinguishable from a seed. The click softmax head did not measurably reshape the shared V in a way that improved within-user long_view order.", "mechanism_update": "The claimed transfer path -- fitting shared item embeddings from ~1.7x more eligible groups via a click head, then benefiting the mixed-label groups that carry all GAUC weight -- produced no measurable lift in this one configuration. That is a single result on a single implementation, not a verdict on multi-task transfer. The more likely reading given prior evidence (item embeddings already dominated by user_id x video_id identity, and click being highly collinear with long_view at r=0.75) is that click gradient largely duplicates long_view gradient rather than adding orthogonal within-user structure, so the shared table sees little new information.", "deprioritise": [], "metrics": {"GAUC": 0.6838030815124512, "nDCG@5": 0.5445868968963623, "primary": 0.6141949892044067, "users": 22377.0, "rows": 124909.0}, "delta_vs_parent": 0.00015461444854736328, "accept_bar": 0.0014, "confirmation": {"seeds": [0, 1, 2], "paired_deltas": [0.000397, -8.9e-05, 6.1e-05], "mean_delta": 0.00012320280075073242, "worst_delta": -8.869171142578125e-05, "all_paired_positive": false, "ensemble_delta": 0.00015461444854736328, "basis": "paired_per_seed"}, "seconds": 610.26, "config": {"model": "fm_listwise_mt", "aux_weight": 0.3}, "seeds": [0, 1, 2], "diff": "--- a/pipeline/features.py\n+++ b/pipeline/features.py\n@@ -36,6 +36,11 @@\n \n FIELDS is not documentation: len(FIELDS) sizes vocabs and the second dimension of X. Add a\n column to raw() and you must register its name in FIELDS, or the shapes will not match.\n+\n+Multi-task note (this iteration): the click auxiliary TARGET is exposed through the\n+module-level AUX dict, aligned 1:1 with enc[split] row order. It is NEVER an input\n+column -- FIELDS is unchanged and is_click never enters X. train.py's fm_listwise_mt\n+branch reads AUX['train'] to add a second within-user softmax head that shares V.\n \"\"\"\n import numpy as np\n \n@@ -43,6 +48,10 @@\n # kit/data.py itself remains the only source of truth.\n IDX = {'date': 0, 'user_id': 1, 'video_id': 2, 'author_id': 3,\n        'tab': 4, 'duration_ms': 5, 'label': 6}\n+\n+# Auxiliary multi-task TARGETS, aligned positionally to enc[split] rows. Populated by\n+# encode() through harness.adapter (which cannot return test rows). Not inputs.\n+AUX = {}\n \n # Post-impression outcome/feedback columns. Never use these to predict the label of the\n # SAME row. Even computed purely from train data, a same-row use leaks: they are\n@@ -82,6 +91,33 @@\n                          f\"same-row input feature (same-row use is limited to multi-task \"\n                          f\"targets; history features must come from other rows)\")\n     return x[IDX[name]]\n+\n+def _load_click_aux(splits, enc):\n+    \"\"\"Populate AUX with the is_click multi-task TARGET, aligned to enc[split] rows.\n+\n+    Sourced through harness.adapter.auxiliary_targets, which date-filters to train+valid\n+    before anything reaches us -- test rows never enter. is_click is used only as a head\n+    target, never as an input column. Any failure leaves AUX empty and the MT branch\n+    falls back to the pure long_view listwise objective.\n+    \"\"\"\n+    AUX.clear()\n+    try:\n+        from harness.adapter import auxiliary_targets\n+        aux_raw = auxiliary_targets(('is_click',))\n+    except Exception:\n+        return\n+    if not isinstance(aux_raw, dict):\n+        return\n+    for sp in ('train', 'valid'):\n+        v = aux_raw.get(sp)\n+        if v is None:\n+            continue\n+        col = v.get('is_click') if isinstance(v, dict) else v\n+        if col is None:\n+            continue\n+        arr = np.asarray(col, dtype=np.float32).reshape(-1)\n+        if sp in enc and len(arr) == len(enc[sp][1]):\n+            AUX[sp] = arr\n \n def encode(splits):\n     \"\"\"Map categorical features to contiguous ids. Unseen values fall into the field's\n@@ -154,4 +190,7 @@\n             col = np.clip(nc[:, j], 0, new_dims[j] - 1)\n             X[:, 5 + j] = col + offsets[5 + j]\n         enc[name] = (X, y, users)\n+\n+    # Expose the click auxiliary target for the multi-task listwise head (targets only).\n+    _load_click_aux(splits, enc)\n     return enc, int(sum(all_dims))\n--- a/pipeline/model.py\n+++ b/pipeline/model.py\n@@ -10,6 +10,10 @@\n             # ALL positives are skipped -- they carry no ordering signal. Normalised by\n             # total positives. This is the loss behind the banked submission; see\n             # `fm_listwise_pure` in train.py. Not interchangeable with step_list below.\n+        .step_listwise_mt(X, y, y_aux, group_offsets, aux_weight) -> loss:float\n+            # Two within-group softmax heads over the SAME user groups sharing V and the\n+            # shared interaction term: the scored long_view head (W/b) plus an auxiliary\n+            # is_click head (W_aux/b_aux). Only the long_view head is used at inference.\n         .step_list(X, y, group_ends, lw_alpha=0.3) -> loss:float\n             # X, y must be pre-sorted so that each user's rows are contiguous.\n             # group_ends: 1D int array of exclusive end offsets into X/y marking each\n@@ -32,6 +36,13 @@\n         self.lr, self.l2 = lr, l2\n         self.mV = np.zeros_like(self.V); self.vV = np.zeros_like(self.V)\n         self.mW = np.zeros_like(self.W); self.vW = np.zeros_like(self.W)\n+        # Task-specific first-order parameters for the auxiliary is_click head. They\n+        # share V (and therefore the interaction term) but keep their own linear weights\n+        # and bias so the aux task can differ in level without disturbing the main head.\n+        # predict() never touches these, so inference is the long_view head only.\n+        self.W_aux = np.zeros(dim, dtype=np.float32)\n+        self.b_aux = np.float32(0.0)\n+        self.mWa = np.zeros_like(self.W_aux); self.vWa = np.zeros_like(self.W_aux)\n         self.t = 0\n \n     def logits(self, X):\n@@ -61,23 +72,14 @@\n         self._apply_grad(X, g, S, E)\n         return float(-np.mean(y * np.log(sigmoid(z) + 1e-9) + (1 - y) * np.log(1 - sigmoid(z) + 1e-9)))\n \n-    def step_listwise(self, X, y, group_offsets):\n-        \"\"\"Within-group softmax cross-entropy. No BCE term, no group cap.\n-\n-        Transcribed from run 20260830T235541Z iteration 1 -- the implementation behind\n-        `submissions/verified_listwise_3seed_ensemble.csv`, hand-verified at +0.00162\n-        over three matched seeds. It had never been committed: it survived only as a\n-        diff inside that run's journal, while the differently-behaved `step_list` below\n-        occupied the `fm_listwise` name. Restored so the banked artifact is reproducible.\n-\n-        Four things distinguish it from `step_list`, and the controlled ablation in\n-        research/objective_ablation does not say which of them matters:\n-          - pure softmax CE here; step_list mixes in lw_alpha * pointwise BCE\n-          - mixed-label groups only here; step_list admits any group with a positive\n-          - normalised by total positives here; step_list by active-group count\n-          - uncapped groups here; step_list subsamples groups larger than `cap`\n-        \"\"\"\n-        z, E, S = self.logits(X)\n+    @staticmethod\n+    def _listwise_grad(z, y, group_offsets):\n+        \"\"\"Per-row softmax-CE gradient (unnormalised) over mixed-label groups only.\n+\n+        Returns (grad, total_pos, loss_sum). Groups with <2 rows, zero positives, or all\n+        positives contribute nothing -- they carry no within-group ordering signal.\n+        Mirrors the mixed-group / positive-count logic of step_listwise.\n+        \"\"\"\n         grad = np.zeros(len(z), dtype=np.float32)\n         total_pos, loss_sum = 0.0, 0.0\n         offs = group_offsets\n@@ -95,12 +97,82 @@\n             grad[s_i:e_i] = pos_count * (expz / denom) - yg\n             loss_sum += -(float(np.sum(yg * zg)) - pos_count * (mx + np.log(denom)))\n             total_pos += pos_count\n-\n+        return grad, total_pos, loss_sum\n+\n+    def step_listwise(self, X, y, group_offsets):\n+        \"\"\"Within-group softmax cross-entropy. No BCE term, no group cap.\n+\n+        Transcribed from run 20260830T235541Z iteration 1 -- the implementation behind\n+        `submissions/verified_listwise_3seed_ensemble.csv`, hand-verified at +0.00162\n+        over three matched seeds. It had never been committed: it survived only as a\n+        diff inside that run's journal, while the differently-behaved `step_list` below\n+        occupied the `fm_listwise` name. Restored so the banked artifact is reproducible.\n+\n+        Four things distinguish it from `step_list`, and the controlled ablation in\n+        research/objective_ablation does not say which of them matters:\n+          - pure softmax CE here; step_list mixes in lw_alpha * pointwise BCE\n+          - mixed-label groups only here; step_list admits any group with a positive\n+          - normalised by total positives here; step_list by active-group count\n+          - uncapped groups here; step_list subsamples groups larger than `cap`\n+        \"\"\"\n+        z, E, S = self.logits(X)\n+        grad, total_pos, loss_sum = self._listwise_grad(z, y, group_offsets)\n         if total_pos <= 0.0:\n             return 0.0\n         g = (grad / total_pos).astype(np.float32)\n         self._apply_grad(X, g, S, E)\n         return float(loss_sum / total_pos)\n+\n+    def step_listwise_mt(self, X, y, y_aux, group_offsets, aux_weight=0.3):\n+        \"\"\"Two shared-V within-group softmax heads: long_view (scored) + is_click (aux).\n+\n+        Both heads reuse the SAME embedding table V and therefore the SAME interaction\n+        term; they differ only in their first-order linear weights (W vs W_aux) and\n+        bias. The click head reorders nothing at inference -- predict() reads the main\n+        head alone -- but its gradient flows into the shared V, so item embeddings get\n+        within-user discriminative structure from the ~1.7x more eligible groups the\n+        click label produces. Gradient of each head is normalised by that head's own\n+        total positive count over mixed groups, exactly as step_listwise does.\n+        \"\"\"\n+        E = self.V[X]                                   # (B,F,k)\n+        S = E.sum(1)                                    # (B,k)\n+        inter = 0.5 * ((S ** 2).sum(1) - (E ** 2).sum((1, 2)))\n+        z_main = self.b + self.W[X].sum(1) + inter\n+        z_aux = self.b_aux + self.W_aux[X].sum(1) + inter\n+\n+        gm_raw, tp_m, ls_m = self._listwise_grad(z_main, y, group_offsets)\n+        ga_raw, tp_a, ls_a = self._listwise_grad(z_aux, y_aux, group_offsets)\n+        if tp_m <= 0.0 and tp_a <= 0.0:\n+            return 0.0\n+\n+        gm = (gm_raw / tp_m) if tp_m > 0.0 else np.zeros_like(gm_raw)\n+        ga = (ga_raw / tp_a) if tp_a > 0.0 else np.zeros_like(ga_raw)\n+        gm = gm.astype(np.float32)\n+        ga = (aux_weight * ga).astype(np.float32)       # aux head scaled once, everywhere\n+        gVfac = (gm + ga).astype(np.float32)            # V sees both heads\n+\n+        gV = np.zeros_like(self.V)\n+        gW = np.zeros_like(self.W)\n+        gWa = np.zeros_like(self.W_aux)\n+        np.add.at(gW, X, gm[:, None])\n+        np.add.at(gWa, X, ga[:, None])\n+        np.add.at(gV, X, gVfac[:, None, None] * (S[:, None, :] - E))\n+        gV += self.l2 * self.V; gW += self.l2 * self.W; gWa += self.l2 * self.W_aux\n+\n+        self.t += 1\n+        b1, b2, eps = 0.9, 0.999, 1e-8\n+        for P, G, M, Vv in ((self.V, gV, self.mV, self.vV),\n+                            (self.W, gW, self.mW, self.vW),\n+                            (self.W_aux, gWa, self.mWa, self.vWa)):\n+            M *= b1; M += (1 - b1) * G\n+            Vv *= b2; Vv += (1 - b2) * (G * G)\n+            P -= self.lr * (M / (1 - b1 ** self.t)) / (np.sqrt(Vv / (1 - b2 ** self.t)) + eps)\n+        self.b -= self.lr * gm.sum()\n+        self.b_aux -= self.lr * ga.sum()\n+\n+        m_loss = (ls_m / tp_m) if tp_m > 0.0 else 0.0\n+        a_loss = (ls_a / tp_a) if tp_a > 0.0 else 0.0\n+        return float(m_loss + aux_weight * a_loss)\n \n     def step_list(self, X, y, group_ends, lw_alpha=0.3):\n         \"\"\"Within-user listwise softmax (ListNet top-1), mixed with pointwise BCE.\n--- a/pipeline/train.py\n+++ b/pipeline/train.py\n@@ -5,6 +5,8 @@\n   --model fm_listwise  : same FM, within-user listwise softmax (ListNet top-1) + BCE mix\n   --model fm_listwise_pure : same FM, PURE within-user softmax CE, no BCE mix,\n                          uncapped groups -- the banked submission's loss\n+  --model fm_listwise_mt : fm_listwise_pure plus a shared-V within-user softmax head on\n+                         the is_click auxiliary target (only long_view scores at inference)\n   --model random       : random scores (lower bound; self-check that the evaluator is intact)\n numpy only. Usage: see README.md\n \"\"\"\n@@ -15,6 +17,7 @@\n # These two lines only make it importable; they do not make kit/ editable.\n sys.path.insert(0, os.path.join(os.path.dirname(os.path.dirname(os.path.abspath(__file__))), 'kit'))\n \n+import features as _features\n from data import load\n from evaluate import evaluate\n from features import encode, FIELDS, IDX\n@@ -114,6 +117,35 @@\n     return batches\n \n \n+def _build_grouped_batches_mt(X, y, y_aux, users, target_bs=8192, rng=None):\n+    \"\"\"Multi-task twin of _build_grouped_batches: carries the aux target through the same\n+    whole-user grouping and shuffle so the click head sees exactly the same user groups\n+    as the long_view head. Returns (Xb, yb, yb_aux, group_offsets) tuples.\n+    \"\"\"\n+    users_arr = np.asarray(users)\n+    order = np.argsort(users_arr, kind='stable')\n+    Xs, ys, yas, us = X[order], y[order], y_aux[order], users_arr[order]\n+    change = np.where(us[1:] != us[:-1])[0] + 1\n+    bounds = np.concatenate(([0], change, [len(us)]))\n+    groups = [(int(bounds[i]), int(bounds[i + 1])) for i in range(len(bounds) - 1)]\n+    if rng is not None:\n+        rng.shuffle(groups)\n+\n+    batches, batch_idx, batch_offsets, cur = [], [], [0], 0\n+    for (st, en) in groups:\n+        batch_idx.extend(range(st, en))\n+        batch_offsets.append(batch_offsets[-1] + (en - st))\n+        cur += (en - st)\n+        if cur >= target_bs:\n+            batches.append((Xs[batch_idx], ys[batch_idx], yas[batch_idx],\n+                            np.array(batch_offsets, dtype=np.int64)))\n+            batch_idx, batch_offsets, cur = [], [0], 0\n+    if batch_idx:\n+        batches.append((Xs[batch_idx], ys[batch_idx], yas[batch_idx],\n+                        np.array(batch_offsets, dtype=np.int64)))\n+    return batches\n+\n+\n # ---------------- listwise batching helpers ----------------\n def _group_rows_by_user(users):\n     \"\"\"users: list-like aligned to X/y rows -> dict user -> np.array of row indices.\"\"\"\n@@ -230,9 +262,56 @@\n         out['test'] = evaluate(ute, yte, m.predict(Xte))\n     return out\n \n+def run_fm_listwise_mt(splits, k=16, lr=0.0005, epochs=40, bs=32768, patience=8, seed=0,\n+                       verbose=True, report_test=False, aux_weight=0.3):\n+    \"\"\"fm_listwise_pure plus a second within-user softmax head on the is_click auxiliary\n+    target, sharing V and the interaction term (FM.step_listwise_mt). The click head\n+    supplies ordering gradient for the ~1.7x more user groups that are click-mixed but\n+    long_view-uniform; only the long_view head scores at inference. Early stopping and\n+    model selection stay on valid primary of the long_view head. Falls back to the pure\n+    objective if the click target is unavailable.\"\"\"\n+    enc, dim = encode(splits)\n+    Xtr, ytr, utr = enc['train']; Xva, yva, uva = enc['valid']\n+    y_aux = _features.AUX.get('train')\n+    have_aux = y_aux is not None and len(y_aux) == len(ytr)\n+    if not have_aux:\n+        print(\"  fm_listwise_mt: click aux unavailable -> pure listwise fallback\", flush=True)\n+        return run_fm_listwise_pure(splits, k=k, lr=lr, epochs=epochs, bs=bs,\n+                                    patience=patience, seed=seed, verbose=verbose,\n+                                    report_test=report_test)\n+    m = FM(dim, k=k, lr=lr, seed=seed)\n+    rng = np.random.default_rng(seed)\n+    best, best_state, bad, best_ep = -1, None, 0, 0\n+    for ep in range(1, epochs + 1):\n+        t0 = time.time()\n+        losses = []\n+        for (Xb, yb, yab, offs) in _build_grouped_batches_mt(Xtr, ytr, y_aux, utr,\n+                                                             target_bs=bs, rng=rng):\n+            losses.append(m.step_listwise_mt(Xb, yb, yab, offs, aux_weight=aux_weight))\n+        va = evaluate(uva, yva, m.predict(Xva))\n+        if verbose:\n+            print(f\"  epoch {ep:2d} | loss {np.mean(losses):.4f} | valid GAUC {va['GAUC']:.4f} \"\n+                  f\"nDCG@5 {va['nDCG@5']:.4f} primary {va['primary']:.4f} | {time.time()-t0:.1f}s\")\n+        if va['primary'] > best + 1e-5:\n+            best, bad, best_ep = va['primary'], 0, ep\n+            best_state = (m.V.copy(), m.W.copy(), np.float32(m.b))\n+        else:\n+            bad += 1\n+            if bad >= patience:\n+                if verbose: print(f\"  early stop at epoch {ep}\")\n+                break\n+    print(f\"  fm_listwise_mt seed={seed} aux_weight={aux_weight} best epoch {best_ep} \"\n+          f\"valid primary {best:.5f}\", flush=True)\n+    m.V, m.W, m.b = best_state\n+    out = {'valid': evaluate(uva, yva, m.predict(Xva))}\n+    if report_test:\n+        Xte, yte, ute = enc['test']\n+        out['test'] = evaluate(ute, yte, m.predict(Xte))\n+    return out\n+\n # ---------------- harness contract ----------------\n-def fit_predict(enc, dim, model='fm_listwise_pure', k=16, lr=0.0005, epochs=40, bs=32768,\n-                patience=8, seed=0, verbose=False, lw_alpha=0.3, cap=64):\n+def fit_predict(enc, dim, model='fm_listwise_mt', k=16, lr=0.0005, epochs=40, bs=32768,\n+                patience=8, seed=0, verbose=False, lw_alpha=0.3, cap=64, aux_weight=0.3):\n     \"\"\"Train on `train` and return raw scores for every split.\n \n     THE HARNESS CALLS THIS. `run_fm`/`run_fm_listwise` above return metrics only, which\n@@ -240,10 +319,9 @@\n     submission built any other way (e.g. kit/submit.py --make) silently ships the\n     untouched baseline instead of whatever this pipeline learned.\n \n-    Default model is `fm_listwise_pure`: the within-user softmax objective this\n-    iteration is testing together with the strictly-prior user aggregates in features.py.\n-    This iteration also slows the schedule (lr 0.0005, bs 32768, patience 8) to test the\n-    under-training hypothesis; best epoch per seed is printed for the pure branch.\n+    Default model is `fm_listwise_mt`: the within-user softmax objective plus a\n+    shared-V is_click auxiliary head this iteration is testing. It falls back to the\n+    pure long_view listwise objective when the click target is unavailable.\n \n     Contract, preserve it when you change the model or the loss:\n         fit_predict(enc, dim, ...) -> {'train': ndarray, 'valid': ndarray, 'test': ndarray}\n@@ -267,6 +345,40 @@\n     if model == 'random':\n         rng = np.random.default_rng(seed)\n         return {sp: rng.random(len(enc[sp][1])) for sp in enc}\n+\n+    if model == 'fm_listwise_mt':\n+        # fm_listwise_pure with an added shared-V click softmax head. Byte-for-byte the\n+        # pure grouped-batch