{"seq": 2, "ts": "2026-08-31T19:49:49Z", "type": "iteration", "prev_hash": "86c973df5709df214c686c8c09a9e829a490e87c698cf840267c1cc31abe0d94", "payload": {"iteration": 1, "hypothesis": "Restoring the verified `fm_listwise_pure` ranking objective AND adding the confirmed strictly-prior user-side aggregate fields (user rate, user-tab, user-author) together raises validation primary by at least +0.0035 over the reproduced pointwise baseline, mainly through GAUC.", "mechanism": "Two independent routes to within-user order. (1) The loss: pointwise BCE spends gradient on absolute probability level, which is invariant under the metric; a within-user softmax over mixed-label groups puts all gradient on score DIFFERENCES inside the list, i.e. exactly the quantity GAUC and nDCG@5 read. (2) The features: user-tab and user-author prior rates VARY across a user's impressions (different tabs, different authors in one list), so they reorder first-order and are C2-legal; the user-level prior rate is constant within a user and acts only via its FM crosses with video_id/author_id/tab embeddings, which is the only channel C2 leaves open for user-side signal.", "predicted": "", "invalid_if": "Mean delta over 3 matched seeds is below +0.0015, or GAUC fails to move above ~0.670 -- either would mean this is not the configuration that produced 0.60609 and I decompose it next iteration (objective alone first).", "evidence": ["Registry: controlled ablation, identical batching/seeds -- pointwise 0.599047, listwise 0.603059; a ranking objective beats pointwise by +0.00401 (3/3 seeds), and `fm_listwise_pure` is the hand-verified banked winner at +0.00162 over the official baseline.", "Registry: prior_user_aggregates is the largest single confirmed gain in the project, +0.00281 mean over 3 matched seeds, worst seed +0.00236, 0.60147 -> 0.60609 as a 3-seed rank average, gain mainly GAUC 0.6674 -> 0.6738.", "That +0.00281 was measured ON TOP of a ranking-objective parent (parent ~0.6033), so this exact composition is a reconstituted known-good configuration, not an untested stack."], "verdict": "KEEP", "reason": "Delta +0.01120 is ~22x the paired noise floor and ~5.6x eps, and GAUC reached 0.68255, clearing the pre-registered 0.670 gate. Both invalid_if conditions are unmet, so this is a real improvement over the pointwise/no-history parent and becomes the new parent.", "mechanism_update": "A within-user ranking objective plus within-user-varying prior-rate features moves primary well past anything static feature-stuffing or width scaling reached, and the movement is concentrated in GAUC as predicted -- consistent with gradient being redirected onto within-list score differences and with C2-legal features that reorder inside a user's list. But this run cannot say how the +0.01120 splits between the two routes.", "deprioritise": [], "metrics": {"GAUC": 0.6825534701347351, "nDCG@5": 0.5442197918891907, "primary": 0.6133866310119629, "users": 22377.0, "rows": 124909.0}, "delta_vs_parent": 0.01120084524154663, "accept_bar": 0.0014, "confirmation": {"seeds": [0, 1, 2], "paired_deltas": [0.011148, 0.010676, 0.011099], "mean_delta": 0.010974367459615072, "worst_delta": 0.010675907135009766, "all_paired_positive": true, "ensemble_delta": 0.01120084524154663, "basis": "paired_per_seed"}, "seconds": 236.35, "config": {"model": "fm_listwise_pure", "k": 16, "lr": 0.001, "bs": 8192, "patience": 4}, "seeds": [0, 1, 2], "diff": "--- a/pipeline/features.py\n+++ b/pipeline/features.py\n@@ -1,111 +1,157 @@\n-\"\"\"Feature engineering -- the only place feature changes are allowed. See AGENT_RULES.md.\r\n-\r\n-kit/data.py is frozen Starter Kit code. It cannot be edited, and this file imports\r\n-nothing from it: it only reads the splits returned by kit.data.load(splits). The per-row\r\n-schema is restated as IDX below. That restatement is not a second source of truth -- if\r\n-anyone changes the row layout in kit/data.py, this has to follow.\r\n-\r\n-Never use ANY test-split data to build features, including its labels and any statistic\r\n-derived from it (for example, do not fit bucket edges on the test split).\r\n-\r\n-Same-row input features must go through same_row(x, name). It refuses the\r\n-post-impression outcome columns in LEAKY_COLUMNS (is_click / is_like / ... /\r\n-play_time_ms / label). Those columns are legal only as multi-task targets for the same\r\n-row, or as history aggregated from OTHER rows (the user's past interactions).\r\n-\r\n-For history aggregates, use harness.history -- do not hand-roll them here:\r\n-\r\n-    from harness.history import prior_stats, bucketize\r\n-    rate, count = prior_stats(splits, signal='label', key='user_id')\r\n-\r\n-It guarantees strictly-earlier ordering, treats tied timestamps as non-predecessors, and\r\n-keeps test outcomes out of every aggregate. Building the same thing by hand in this file\r\n-means touching the label directly, which the static guard rejects, and it is the wrong\r\n-place to get the ordering right anyway.\r\n-\r\n-kit/data.py currently loads only the label out of those 11 columns. The other 10 are not\r\n-in IDX, so same_row() raises KeyError on them, which is the safe failure. Reach them\r\n-through harness.adapter, never by opening a raw CSV: log_standard_4_22_to_5_08_pure.csv\r\n-spans validation AND test and carries long_view.\r\n-\r\n-Public contract:\r\n-\r\n-    encode(splits) -> (enc, dim)\r\n-    enc[name] = (X, y, users)    # X: int32 (N, len(FIELDS)); y: float32 (N,); users: list\r\n-    dim                          # total vocab size across fields, fed to model.FM(dim, ...)\r\n-\r\n-FIELDS is not documentation: len(FIELDS) sizes vocabs and the second dimension of X. Add a\r\n-column to raw() and you must register its name in FIELDS, or the shapes will not match.\r\n-\"\"\"\r\n-import numpy as np\r\n-\r\n-# Field order of the fixed-length tuple returned by kit/data.py's load(). A restatement;\r\n-# kit/data.py itself remains the only source of truth.\r\n-IDX = {'date': 0, 'user_id': 1, 'video_id': 2, 'author_id': 3,\r\n-       'tab': 4, 'duration_ms': 5, 'label': 6}\r\n-\r\n-# Post-impression outcome/feedback columns. Never use these to predict the label of the\r\n-# SAME row. Even computed purely from train data, a same-row use leaks: they are\r\n-# concurrent outcomes of the same impression as the label, not information available\r\n-# before it. kit/data.py currently loads only the label; the rest are absent from IDX, so\r\n-# same_row() raises KeyError on them (the safe failure). The full set of 11 names is\r\n-# listed here for when those columns are eventually read in.\r\n-LEAKY_COLUMNS = frozenset({\r\n-    'label',            # long_view, the main task target itself\r\n-    'is_click', 'is_like', 'is_follow', 'is_comment', 'is_forward',\r\n-    'is_hate', 'play_time_ms', 'profile_stay_time', 'comment_stay_time',\r\n-    'is_profile_enter',\r\n-})\r\n-\r\n-# The 5 feature fields of the current kit baseline. To add a feature, add a column in\r\n-# raw() and register its name here.\r\n-FIELDS = ['user_id', 'video_id', 'author_id', 'tab', 'dur_bucket']\r\n-\r\n-def _bucket_edges(values, n=10):\r\n-    return np.quantile(np.asarray(values), np.linspace(0, 1, n + 1)[1:-1])\r\n-\r\n-def same_row(x, name):\r\n-    \"\"\"Read one column of the current row as an input feature for that row.\r\n-\r\n-    Post-impression outcome columns (see LEAKY_COLUMNS) raise here. They are legal only\r\n-    as multi-task targets for the same row, or as history features built from other\r\n-    rows -- never as an input for the row being predicted, which would feed the model\r\n-    the answer it is meant to produce.\r\n-    \"\"\"\r\n-    if name in LEAKY_COLUMNS:\r\n-        raise ValueError(f\"{name!r} is a post-impression outcome column and cannot be a \"\r\n-                         f\"same-row input feature (same-row use is limited to multi-task \"\r\n-                         f\"targets; history features must come from other rows)\")\r\n-    return x[IDX[name]]\r\n-\r\n-def encode(splits):\r\n-    \"\"\"Map categorical features to contiguous ids. Unseen values fall into the field's\r\n-    UNK slot. Bucket edges may be fitted on splits['train'] only, never valid/test.\"\"\"\r\n-    tr = splits['train']\r\n-    edges = _bucket_edges([same_row(x, 'duration_ms') for x in tr])\r\n-\r\n-    def raw(x):\r\n-        return [same_row(x, 'user_id'), same_row(x, 'video_id'), same_row(x, 'author_id'),\r\n-                same_row(x, 'tab'), str(int(np.searchsorted(edges, same_row(x, 'duration_ms'))))]\r\n-\r\n-    vocabs = [dict() for _ in FIELDS]\r\n-    for x in tr:\r\n-        for i, v in enumerate(raw(x)):\r\n-            if v not in vocabs[i]:\r\n-                vocabs[i][v] = len(vocabs[i])\r\n-    unk = [len(v) for v in vocabs]                 # one UNK slot at the end of each field\r\n-    field_dims = [len(v) + 1 for v in vocabs]\r\n-    offsets = np.cumsum([0] + field_dims[:-1]).astype(np.int32)\r\n-\r\n-    enc = {}\r\n-    for name, rws in splits.items():\r\n-        X = np.empty((len(rws), len(FIELDS)), dtype=np.int32)\r\n-        y = np.empty(len(rws), dtype=np.float32)\r\n-        users = []\r\n-        for n, x in enumerate(rws):\r\n-            for i, v in enumerate(raw(x)):\r\n-                X[n, i] = vocabs[i].get(v, unk[i]) + offsets[i]\r\n-            y[n] = x[IDX['label']]\r\n-            users.append(x[IDX['user_id']])\r\n-        enc[name] = (X, y, users)\r\n-    return enc, int(sum(field_dims))\r\n+\"\"\"Feature engineering -- the only place feature changes are allowed. See AGENT_RULES.md.\n+\n+kit/data.py is frozen Starter Kit code. It cannot be edited, and this file imports\n+nothing from it: it only reads the splits returned by kit.data.load(splits). The per-row\n+schema is restated as IDX below. That restatement is not a second source of truth -- if\n+anyone changes the row layout in kit/data.py, this has to follow.\n+\n+Never use ANY test-split data to build features, including its labels and any statistic\n+derived from it (for example, do not fit bucket edges on the test split).\n+\n+Same-row input features must go through same_row(x, name). It refuses the\n+post-impression outcome columns in LEAKY_COLUMNS (is_click / is_like / ... /\n+play_time_ms / label). Those columns are legal only as multi-task targets for the same\n+row, or as history aggregated from OTHER rows (the user's past interactions).\n+\n+For history aggregates, use harness.history -- do not hand-roll them here:\n+\n+    from harness.history import prior_stats, bucketize\n+    rate, count = prior_stats(splits, signal='label', key='user_id')\n+\n+It guarantees strictly-earlier ordering, treats tied timestamps as non-predecessors, and\n+keeps test outcomes out of every aggregate. Building the same thing by hand in this file\n+means touching the label directly, which the static guard rejects, and it is the wrong\n+place to get the ordering right anyway.\n+\n+kit/data.py currently loads only the label out of those 11 columns. The other 10 are not\n+in IDX, so same_row() raises KeyError on them, which is the safe failure. Reach them\n+through harness.adapter, never by opening a raw CSV: log_standard_4_22_to_5_08_pure.csv\n+spans validation AND test and carries long_view.\n+\n+Public contract:\n+\n+    encode(splits) -> (enc, dim)\n+    enc[name] = (X, y, users)    # X: int32 (N, len(FIELDS)); y: float32 (N,); users: list\n+    dim                          # total vocab size across fields, fed to model.FM(dim, ...)\n+\n+FIELDS is not documentation: len(FIELDS) sizes vocabs and the second dimension of X. Add a\n+column to raw() and you must register its name in FIELDS, or the shapes will not match.\n+\"\"\"\n+import numpy as np\n+\n+# Field order of the fixed-length tuple returned by kit/data.py's load(). A restatement;\n+# kit/data.py itself remains the only source of truth.\n+IDX = {'date': 0, 'user_id': 1, 'video_id': 2, 'author_id': 3,\n+       'tab': 4, 'duration_ms': 5, 'label': 6}\n+\n+# Post-impression outcome/feedback columns. Never use these to predict the label of the\n+# SAME row. Even computed purely from train data, a same-row use leaks: they are\n+# concurrent outcomes of the same impression as the label, not information available\n+# before it. kit/data.py currently loads only the label; the rest are absent from IDX, so\n+# same_row() raises KeyError on them (the safe failure). The full set of 11 names is\n+# listed here for when those columns are eventually read in.\n+LEAKY_COLUMNS = frozenset({\n+    'label',            # long_view, the main task target itself\n+    'is_click', 'is_like', 'is_follow', 'is_comment', 'is_forward',\n+    'is_hate', 'play_time_ms', 'profile_stay_time', 'comment_stay_time',\n+    'is_profile_enter',\n+})\n+\n+# The 5 official kit fields, plus strictly-prior user-side aggregates built through\n+# harness.history (earlier rows only, test outcomes never enter). The (user,tab) and\n+# (user,author) conditional rates VARY within a user's list, so they reorder first-order\n+# and are C2-legal; the user-level rate/count are constant within a user and act only via\n+# their FM crosses with item/context embeddings -- the one channel C2 leaves open.\n+FIELDS = ['user_id', 'video_id', 'author_id', 'tab', 'dur_bucket',\n+          'user_rate', 'user_cnt', 'user_tab_rate', 'user_tab_cnt',\n+          'user_author_rate', 'user_author_cnt']\n+\n+def _bucket_edges(values, n=10):\n+    return np.quantile(np.asarray(values), np.linspace(0, 1, n + 1)[1:-1])\n+\n+def same_row(x, name):\n+    \"\"\"Read one column of the current row as an input feature for that row.\n+\n+    Post-impression outcome columns (see LEAKY_COLUMNS) raise here. They are legal only\n+    as multi-task targets for the same row, or as history features built from other\n+    rows -- never as an input for the row being predicted, which would feed the model\n+    the answer it is meant to produce.\n+    \"\"\"\n+    if name in LEAKY_COLUMNS:\n+        raise ValueError(f\"{name!r} is a post-impression outcome column and cannot be a \"\n+                         f\"same-row input feature (same-row use is limited to multi-task \"\n+                         f\"targets; history features must come from other rows)\")\n+    return x[IDX[name]]\n+\n+def encode(splits):\n+    \"\"\"Map categorical features to contiguous ids. Unseen values fall into the field's\n+    UNK slot. Bucket edges may be fitted on splits['train'] only, never valid/test.\n+\n+    Beyond the 5 official identity/context fields, six coarse buckets summarise each\n+    user's strictly-earlier long_view behaviour, sourced through harness.history so the\n+    ordering is correct and no test outcome ever enters an aggregate.\n+    \"\"\"\n+    from harness.history import prior_stats, bucketize\n+\n+    tr = splits['train']\n+    edges = _bucket_edges([same_row(x, 'duration_ms') for x in tr])\n+\n+    base_fields = FIELDS[:5]\n+    n_new = len(FIELDS) - 5\n+\n+    def raw(x):\n+        return [same_row(x, 'user_id'), same_row(x, 'video_id'), same_row(x, 'author_id'),\n+                same_row(x, 'tab'), str(int(np.searchsorted(edges, same_row(x, 'duration_ms'))))]\n+\n+    vocabs = [dict() for _ in base_fields]\n+    for x in tr:\n+        for i, v in enumerate(raw(x)):\n+            if v not in vocabs[i]:\n+                vocabs[i][v] = len(vocabs[i])\n+    unk = [len(v) for v in vocabs]                 # one UNK slot at the end of each field\n+    base_dims = [len(v) + 1 for v in vocabs]\n+\n+    # ---- strictly-prior user-side aggregates (harness.history: earlier rows only) ----\n+    u_rate, u_cnt = prior_stats(splits, signal='label', key='user_id', prior_weight=20.0)\n+    ut_rate, ut_cnt = prior_stats(splits, signal='label', key=('user_id', 'tab'),\n+                                  prior_weight=20.0)\n+    ua_rate, ua_cnt = prior_stats(splits, signal='label', key=('user_id', 'author_id'),\n+                                  prior_weight=20.0)\n+\n+    q = [0.2, 0.4, 0.6, 0.8]                        # 4 edges -> 5 rate buckets, TRAIN only\n+    u_edges = np.quantile(u_rate['train'], q)\n+    ut_edges = np.quantile(ut_rate['train'], q)\n+    ua_edges = np.quantile(ua_rate['train'], q)\n+    cnt_edges = np.array([0.5, 2.5, 5.5, 20.5])     # support count: 0 / 1-2 / 3-5 / 6-20 / 21+\n+\n+    def new_cols(s):\n+        return np.stack([\n+            bucketize(u_rate[s], u_edges),\n+            bucketize(u_cnt[s], cnt_edges),\n+            bucketize(ut_rate[s], ut_edges),\n+            bucketize(ut_cnt[s], cnt_edges),\n+            bucketize(ua_rate[s], ua_edges),\n+            bucketize(ua_cnt[s], cnt_edges),\n+        ], axis=1).astype(np.int32)\n+\n+    new_dims = [5] * n_new                          # each new field has 5 buckets\n+    all_dims = base_dims + new_dims\n+    offsets = np.cumsum([0] + all_dims[:-1]).astype(np.int32)\n+\n+    enc = {}\n+    for name, rws in splits.items():\n+        X = np.empty((len(rws), len(FIELDS)), dtype=np.int32)\n+        y = np.empty(len(rws), dtype=np.float32)\n+        users = []\n+        for n, x in enumerate(rws):\n+            for i, v in enumerate(raw(x)):\n+                X[n, i] = vocabs[i].get(v, unk[i]) + offsets[i]\n+            y[n] = x[IDX['label']]\n+            users.append(x[IDX['user_id']])\n+        nc = new_cols(name)\n+        for j in range(n_new):\n+            # clip guards against a bucket index at the field width when quantile edges tie\n+            col = np.clip(nc[:, j], 0, new_dims[j] - 1)\n+            X[:, 5 + j] = col + offsets[5 + j]\n+        enc[name] = (X, y, users)\n+    return enc, int(sum(all_dims))\n--- a/pipeline/train.py\n+++ b/pipeline/train.py\n@@ -187,15 +187,56 @@\n         out['test'] = evaluate(ute, yte, m.predict(Xte))\n     return out\n \n+def run_fm_listwise_pure(splits, k=16, lr=0.001, epochs=40, bs=8192, patience=4, seed=0,\n+                         verbose=True, report_test=False):\n+    \"\"\"Same FM capacity as run_fm, trained with the PURE within-user softmax\n+    cross-entropy (FM.step_listwise): no BCE term mixed in, mixed-label groups only,\n+    uncapped full lists, gradient normalised by the batch's total positive count. Whole\n+    user groups are packed into ~bs-row batches by _build_grouped_batches so a user is\n+    never split across a batch boundary. Early stopping/model selection stay on valid\n+    primary. This is the banked listwise objective; it pairs with the fit_predict\n+    `fm_listwise_pure` branch used to build the submission.\"\"\"\n+    enc, dim = encode(splits)\n+    Xtr, ytr, utr = enc['train']; Xva, yva, uva = enc['valid']\n+    m = FM(dim, k=k, lr=lr, seed=seed)\n+    rng = np.random.default_rng(seed)\n+    best, best_state, bad = -1, None, 0\n+    for ep in range(1, epochs + 1):\n+        t0 = time.time()\n+        losses = []\n+        for (Xb, yb, offs) in _build_grouped_batches(Xtr, ytr, utr, target_bs=bs, rng=rng):\n+            losses.append(m.step_listwise(Xb, yb, offs))\n+        va = evaluate(uva, yva, m.predict(Xva))\n+        if verbose:\n+            print(f\"  epoch {ep:2d} | loss {np.mean(losses):.4f} | valid GAUC {va['GAUC']:.4f} \"\n+                  f\"nDCG@5 {va['nDCG@5']:.4f} primary {va['primary']:.4f} | {time.time()-t0:.1f}s\")\n+        if va['primary'] > best + 1e-5:\n+            best, bad = va['primary'], 0\n+            best_state = (m.V.copy(), m.W.copy(), np.float32(m.b))\n+        else:\n+            bad += 1\n+            if bad >= patience:\n+                if verbose: print(f\"  early stop at epoch {ep}\")\n+                break\n+    m.V, m.W, m.b = best_state\n+    out = {'valid': evaluate(uva, yva, m.predict(Xva))}\n+    if report_test:\n+        Xte, yte, ute = enc['test']\n+        out['test'] = evaluate(ute, yte, m.predict(Xte))\n+    return out\n+\n # ---------------- harness contract ----------------\n-def fit_predict(enc, dim, model='fm', k=16, lr=0.001, epochs=40, bs=8192, patience=4,\n-                seed=0, verbose=False, lw_alpha=0.3, cap=64):\n+def fit_predict(enc, dim, model='fm_listwise_pure', k=16, lr=0.001, epochs=40, bs=8192,\n+                patience=4, seed=0, verbose=False, lw_alpha=0.3, cap=64):\n     \"\"\"Train on `train` and return raw scores for every split.\n \n     THE HARNESS CALLS THIS. `run_fm`/`run_fm_listwise` above return metrics only, which\n     is enough for a human reading stdout but not enough to build a submission -- and a\n     submission built any other way (e.g. kit/submit.py --make) silently ships the\n     untouched baseline instead of whatever this pipeline learned.\n+\n+    Default model is `fm_listwise_pure`: the within-user softmax objective this\n+    iteration is testing together with the strictly-prior user aggregates in features.py.\n \n     Contract, preserve it when you change the model or the loss:\n         fit_predict(enc, dim, ...) -> {'train': ndarray, 'valid': ndarray, 'test': ndarray}\n@@ -268,7 +309,7 @@\n         m.V, m.W, m.b = best_state\n         return {sp: m.predict(enc[sp][0]) for sp in enc}\n \n-    # default: model == 'fm', pointwise BCE\n+    # model == 'fm', pointwise BCE\n     m = FM(dim, k=k, lr=lr, seed=seed)\n     rng = np.random.default_rng(seed)\n     best, best_state, bad = -1, None, 0\n@@ -316,7 +357,10 @@\n                                    report_test=a.final),\n            'fm_listwise': lambda s: run_fm_listwise(s, k=a.k, lr=a.lr, epochs=a.epochs,\n                                                      seed=a.seed, report_test=a.final,\n-                                                     lw_alpha=a.lw_alpha, cap=a.cap)}[a.model](splits)\n+                                                     lw_alpha=a.lw_alpha, cap=a.cap),\n+           'fm_listwise_pure': lambda s: run_fm_listwise_pure(s, k=a.k, lr=a.lr,\n+                                                              epochs=a.epochs, seed=a.seed,\n+                                                            