{"seq": 10, "ts": "2026-08-31T20:38:51Z", "type": "FINAL_DESIGNATION", "prev_hash": "407a5eaa4a2cfd3226e1923d15f51d61fa06c67c71afbb7969a9069bd36bf929", "payload": {"stop_reason": "converged", "chosen_kind": "single", "chosen_iteration": 5, "chosen_label": "Adding a second within-user listwise softmax head on `is_click`, sharing the FM ", "validation_primary": 0.6141870021820068, "selection": {"n_candidates": 5, "folds": 5, "min_fold_wins": 4, "evaluated": [{"iteration": 5, "label": "Adding a second within-user listwise softmax head on `is_click`, shari", "pooled_a": 0.61419, "pooled_b": 0.60216, "pooled_delta": 0.01203, "fold_wins": 5, "folds": 5, "fold_deltas": [0.01457, 0.01143, 0.00718, 0.01559, 0.01159], "fold_delta_mean": 0.01207, "fold_delta_sd": 0.00329, "stable": true}, {"iteration": 4, "label": "The listwise arm is under-trained, not under-featured: with a smaller ", "pooled_a": 0.61408, "pooled_b": 0.60216, "pooled_delta": 0.01193, "fold_wins": 5, "folds": 5, "fold_deltas": [0.01437, 0.01159, 0.00759, 0.01532, 0.01097], "fold_delta_mean": 0.01197, "fold_delta_sd": 0.00306, "stable": true}, {"iteration": 1, "label": "Restoring the verified `fm_listwise_pure` ranking objective AND adding", "pooled_a": 0.61341, "pooled_b": 0.60216, "pooled_delta": 0.01125, "fold_wins": 5, "folds": 5, "fold_deltas": [0.01515, 0.00921, 0.00555, 0.01537, 0.01124], "fold_delta_mean": 0.01131, "fold_delta_sd": 0.00415, "stable": true}, {"iteration": 3, "label": "rank-average of 1,0", "pooled_a": 0.60871, "pooled_b": 0.60216, "pooled_delta": 0.00655, "fold_wins": 5, "folds": 5, "fold_deltas": [0.0081, 0.0059, 0.00424, 0.00906, 0.00562], "fold_delta_mean": 0.00658, "fold_delta_sd": 0.00196, "stable": true}, {"iteration": 0, "label": "baseline", "pooled_a": 0.60216, "pooled_b": 0.60216, "pooled_delta": 0.0, "fold_wins": 0, "folds": 5, "fold_deltas": [0.0, 0.0, 0.0, 0.0, 0.0], "fold_delta_mean": 0.0, "fold_delta_sd": 0.0, "stable": false}], "decisions": ["best stable single candidate: iteration 5"], "baseline_primary": 0.60216, "ensemble": {"members": [5, 4, 1, 3], "members_individually_stable": [5, 4, 1, 3], "vs": "single", "pooled_a": 0.61375, "pooled_b": 0.61419, "pooled_delta": -0.00044, "fold_wins": 1, "folds": 5, "fold_deltas": [0.00017, -0.00053, -0.00052, -0.00088, -0.00041], "fold_delta_mean": -0.00043, "fold_delta_sd": 0.00038, "stable": false}, "vs_floor": {"pooled_a": 0.61419, "pooled_b": 0.60274, "pooled_delta": 0.01145, "fold_wins": 5, "folds": 5, "fold_deltas": [0.01445, 0.01069, 0.00773, 0.01422, 0.01035], "fold_delta_mean": 0.01149, "fold_delta_sd": 0.00284, "stable": true}, "chosen": {"kind": "single", "iteration": 5, "label": "Adding a second within-user listwise softmax head on `is_click`, sharing the FM ", "validation_primary": 0.61419, "delta_vs_baseline": 0.01203}}, "candidates_considered": [{"iteration": 0, "primary": 0.6021857857704163, "label": "baseline", "seeds": [0, 1, 2], "artifact": "rank_average_ensemble", "artifact_source": "official_baseline"}, {"iteration": 1, "primary": 0.6133866310119629, "label": "Restoring the verified `fm_listwise_pure` ranking objective AND adding the confi", "seeds": [0, 1, 2], "artifact": "rank_average_ensemble", "artifact_source": "agent_hypothesis"}, {"iteration": 3, "primary": 0.6086416244506836, "label": "rank-average of 1,0", "seeds": [], "artifact": "rank_average_of_nodes", "artifact_source": "harness_ensemble"}, {"iteration": 4, "primary": 0.6140403747558594, "label": "The listwise arm is under-trained, not under-featured: with a smaller learning r", "seeds": [0, 1, 2], "artifact": "rank_average_ensemble", "artifact_source": "agent_hypothesis"}, {"iteration": 5, "primary": 0.6141949892044067, "label": "Adding a second within-user listwise softmax head on `is_click`, sharing the FM ", "seeds": [0, 1, 2], "artifact": "rank_average_ensemble", "artifact_source": "agent_hypothesis"}], "chosen_artifact": "rank_average_ensemble", "chosen_artifact_source": "agent_hypothesis", "chosen_seeds": [0, 1, 2], "submission": "C:\\Users\\nicho\\OneDrive\\Documents\\Hackathon\\kuairand-starter-kit\\submissions\\run_20260831T193724Z_final.csv", "submission_sha256": "e3f55ed563cfcb6a1b0ccb70dea0e3a57aae46a7cd35dbe16e5159efc0d746de", "submission_check_ok": true, "submission_check_msg": "row_id contract OK: 170588 rows, split=test", "iterations_used": 4, "iteration_cap": 50, "wall_clock_s": 3667.1, "resources": {"calls": 15, "input": 124241, "output": 185756, "cache_write": 34669, "cache_read": 480749, "usd": 5.8522, "by_role": {"proposer": {"calls": 5, "input": 200219, "output": 43687, "cache_write": 0, "cache_read": 177170, "usd": 1.296005}, "coder": {"calls": 6, "input": 291961, "output": 138907, "cache_write": 33772, "cache_read": 168860, "usd": 4.34147}, "reflector": {"calls": 4, "input": 147479, "output": 3162, "cache_write": 897, "cache_read": 134719, "usd": 0.214694}}, "tokens_total": 825415}, "gpu_hours": 0.0, "cache_working": true}, "hash": "71f6013e6fe7f0752736bd30171198fed660085753b86876e0ff082a42a93c97"}
{"seq": 11, "ts": "2026-08-31T20:38:51Z", "type": "converged", "prev_hash": "71f6013e6fe7f0752736bd30171198fed660085753b86876e0ff082a42a93c97", "payload": {"eps": 0.002, "N": 3, "best_history": [0.6021857857704163, 0.6133866310119629, 0.6133866310119629, 0.6140403747558594, 0.6141949892044067]}, "hash": "aca7b98a0d1dc9ce04a76c04b86669a2c6a6be402c40d7962726e25b6960217e"}
